PUBLICZNA SZKOŁA PODSTAWOWA IM.POWSTAŃCÓW 1863 ROKU W NAGOSZEWIE, , 07-300, TURKA,21.82001978,52.74592765, 59.03333333333333, 997.6333333333333, 25.291666666666668,7.916666666666667,6.808333333333334, 2026-07-17 22:57:28
SZKOŁA PODSTAWOWA NR 3 IM. PODRÓŻNIKÓW I ODKRYWCÓW POLSKICH W OLEŚNICY, UL. JANA KOCHANOWSKIEGO, 56-400, OLEŚNICA,17.3900401,51.210936, 88.30833333333334, 990.5583333333334, 21.575,8.541666666666666,7.774999999999999, 2026-07-17 22:57:28
NIEPUBLICZNA OGÓLNOKSZTAŁCĄCA SZKOŁA MUZYCZNA I STOPNIA CLEVER W WAŁBRZYCHU, UL. ARMII KRAJOWEJ, 58-302, WAŁBRZYCH,16.2868599,50.8040348, 81.53999999999999, 961.51, 21.84,8.81,7.67, 2026-07-17 22:57:28
II LICEUM OGÓLNOKSZTAŁCĄCE IM. CYPRIANA KAMILA NORWIDA W JELENIEJ GÓRZE, UL. GIMNAZJALNA, 58-560, JELENIA GÓRA,15.683888637696665,50.866245288517455, 73.88000000000001, 969.5799999999999, 22.5,6.27,5.32, 2026-07-17 22:57:28
SZKOŁA PODSTAWOWA Z ODDZIAŁAMI INTEGRACYJNYMI IM. POWSTAŃCÓW WIELKOPOLSKICH W BODZEWIE, , 63-820, BODZEWO,17.070719,51.8485949, 80.25, 993.4916666666667, 21.14166666666667,5.55,5.55, 2026-07-17 22:57:28
SZKOŁA PODSTAWOWA W MILEJCZYCACH, UL. SZKOLNA, 17-332, MILEJCZYCE,23.1365379,52.5189199, 51.65, 990.0500000000001, 25.383333333333336,10.858333333333334,9.158333333333331, 2026-07-17 22:57:28
SZKOŁA PODSTAWOWA W WĄSICACH, UL. GŁÓWNA, 46-250, WĄSICE,18.029775,50.983905, 100.0, 992.4250000000001, 22.40833333333333,10.966666666666669,10.033333333333331, 2026-07-17 22:57:28
I LICEUM OGÓLNOKSZTAŁCĄCE IM. HENRYKA SIENKIEWICZA  W MALBORKU, UL. 17 MARCA, 82-200, MALBORK,19.0379763,54.0361319, 63.44166666666666, 1004.4583333333334, 25.191666666666666,9.25,8.558333333333334, 2026-07-17 22:57:28
SZKOŁA PODSTAWOWA NR 16 W ZABRZU, UL. JÓZEFA LOMPY, 41-806, ZABRZE,18.8139578,50.2870184, 89.07272727272726, 980.5272727272727, 20.61818181818182,5.945454545454546,4.736363636363636, 2026-07-17 22:57:28
SZKOŁA PODSTAWOWA NR 4 IM. I SAMODZIELNEJ WARSZAWSKIEJ BRYGADY KAWALERII W GRYFICACH, UL. SIENKIEWICZA, 72-300, GRYFICE,15.19512694,53.9126862, 75.31666666666666, 1005.75, 23.191666666666666,12.316666666666668,10.35, 2026-07-17 22:57:28
SZKOŁA PODSTAWOWA IM. JANA PAWŁA II W RACŁAWICACH ŚLĄSKICH, UL. ZWYCIĘSTWA, 48-250, RACŁAWICE ŚLĄSKIE,17.771528,50.311402, 87.55833333333334, 984.1999999999999, 20.05,5.958333333333333,5.316666666666666, 2026-07-17 22:57:28
SZKOŁA PODSTAWOWA W STRZELECZKACH, UL. SIENKIEWICZA, 47-364, STRZELECZKI,17.8541788,50.4590123, 89.24, 987.7299999999999, 20.15,205.71,177.18, 2026-07-17 22:57:28
SPORTOWA SZKOŁA PODSTAWOWA W SŁUPSKU, UL. MARII ZABOROWSKIEJ, 76-200, SŁUPSK,17.0284824,54.464148, 85.40833333333335, 999.9083333333333, 20.033333333333335,7.583333333333333,6.716666666666666, 2026-07-17 22:57:28
SZKOŁA PODSTAWOWA IM. TYSIĄCLECIA PAŃSTWA POLSKIEGO W DZIERZGOŃ, UL. KRZYWA, 82-440, DZIERZGOŃ,19.349508,53.92348, 55.85, 1004.7416666666667, 26.758333333333336,11.416666666666666,10.016666666666667, 2026-07-17 22:57:28
SZKOŁA PODSTAWOWA W POLANCE WIELKIEJ, UL. DŁUGA, 32-607, POLANKA WIELKA,19.326337,49.985272, 70.65833333333333, 979.5500000000001, 24.258333333333336,13.816666666666668,11.308333333333332, 2026-07-17 22:57:28
SZKOŁA PODSTAWOWA IM. KARDYNAŁA STEFANA WYSZYŃSKIEGO W GRUSZOWIE WIELKIM, , 33-200, GRUSZÓW WIELKI,21.03335443,50.19213307, 71.275, 985.0833333333334, 24.55,16.366666666666667,14.183333333333332, 2026-07-17 22:57:28
SZKOŁA PODSTAWOWA IM. GEN. DYW. TADEUSZA KUTRZEBY W KOŹLU, , 95-011, KOŹLE,19.58919231,51.93825404, 62.975, 990.35, 25.84166666666667,11.216666666666669,9.241666666666667, 2026-07-17 22:57:28
TECHNIKUM NR 3 W MALBORKU, UL. ALEJA WOJSKA POLSKIEGO, 82-200, MALBORK,19.0530892,54.0360115, 68.76666666666667, 1004.2833333333333, 24.291666666666668,8.733333333333333,8.625, 2026-07-17 22:57:28
SZKOŁA PODSTAWOWA W LUCIENIU, , 09-500, LUCIEŃ,19.472959,52.4884269, 66.36666666666666, 997.9583333333334, 25.741666666666664,12.083333333333334,10.15, 2026-07-17 22:57:28
SZKOŁA PODSTAWOWA NR 5 W RUDZIE ŚLĄSKIEJ, UL. PIOTRA NIEDURNEGO, 41-708, RUDA ŚLĄSKA,18.8815597,50.30117879, 86.025, 974.7625, 21.4125,4.925,4.0875, 2026-07-17 22:57:28
NIEPUBLICZNA SZKOŁA PODSTAWOWA W BZINICY STAREJ, UL. KAROLA MIARKI, 46-380, BZINICA STARA,18.4612867,50.6892203, 0.0, 983.0583333333334, 20.091666666666665,8.866666666666667,7.916666666666667, 2026-07-17 22:57:28
SZKOŁA PODSTAWOWA IM. PPOR. EMILII GIERCZAK W POSTOMINIE, , 76-113, POSTOMINO,16.71239247,54.48931415, 88.08181818181818, 1002.0545454545455, 19.436363636363637,7.736363636363635,6.427272727272728, 2026-07-17 22:57:28
SZKOŁA PODSTAWOWA NR 2 IM. MARII SKŁODOWSKIEJ-CURIE W KRZEPICACH, UL. SKŁODOWSKIEJ, 42-160, KRZEPICE,18.702433,50.964886, 91.7375, 983.225, 20.75,5.8,4.7125, 2026-07-17 22:57:28
PUBLICZNA SZKOŁA PODSTAWOWA IM. MIKOŁAJA KOPERNIKA W TARNOWIE OPOLSKIM, UL. KOPERNIKA, 46-050, TARNÓW OPOLSKI,18.078098161771777,50.57654911811356, 92.125, 988.6750000000001, 20.583333333333332,6.941666666666666,5.899999999999999, 2026-07-17 22:57:28
SZKOŁA PODSTAWOWA NR 1 IM.POWSTANCÓW WIELKOPOLSKICH W LEGNICY, UL. KAMIENNA, 59-220, LEGNICA,16.173446,51.210851, 56.73333333333333, 1009.9833333333332, 26.791666666666668,7.35,6.408333333333332, 2026-07-17 22:57:28
III LICEUM OGÓLNOKSZTAŁCĄCE IM. KAZIMIERZA KOSIŃSKIEGO W KŁOBUCKU, UL. KS. IGNACEGO SKORUPKI, 42-100, KŁOBUCK,18.9423379,50.9004679, 88.425, 979.7333333333332, 20.458333333333332,4.966666666666667,4.008333333333334, 2026-07-17 22:57:28
SZKOŁA PODSTAWOWA NR 10 IM ZOFII KOSSAK W LEGNICY, UL. JAWORZYŃSKA, 59-220, LEGNICA,16.1588159,51.1992709, 59.56666666666666, 993.4083333333333, 26.575,6.758333333333333,5.7, 2026-07-17 22:57:28
SZKOŁA PODSTAWOWA NR 9 W LEGNICY, UL. MARYNARSKA, 59-220, LEGNICA,16.141123,51.202816, 57.541666666666664, 992.7416666666667, 26.09166666666667,6.758333333333333,5.675, 2026-07-17 22:57:28
SZKOŁA PODSTAWOWA NR 1 IM. ŚW.JANA PAWŁA II W KŁODAWIE, UL. KOŚCIELNA, 62-650, KŁODAWA,18.9134684,52.2542661, 88.8, 993.5, 21.55,11.833333333333334,9.8, 2026-07-17 22:57:28
SZKOŁA PODSTAWOWA NR 31 IM. GEN. JÓZEFA HALLERA W TORUNIU, UL. WŁADYSŁAWA DZIEWULSKIEGO, 87-100, TORUŃ,18.6812901,53.0291419, 89.21666666666665, 999.0916666666667, 22.15833333333333,15.883333333333333,13.975, 2026-07-17 22:57:28
SZKOŁA PODSTAWOWA IM.ORŁA BIAŁEGO W DOBRZENIU, , 56-410, DOBRZEŃ,17.2950269,51.2416989, 83.65454545454546, 990.2818181818183, 21.927272727272726,7.009090909090909,6.19090909090909, 2026-07-17 22:57:28
SZKOŁA PODSTAWOWA W DŁUGOPOLU DOLNYM, , 57-520, DŁUGOPOLE DOLNE,16.6369911,50.256696, 88.14, 968.1299999999999, 19.330000000000002,3.7,3.19, 2026-07-17 22:57:28
SZKOŁA PODSTAWOWA IM.WŁADYSŁAWA STANISŁAWA REYMONTA W ŚCIĘGNACH, , 58-535, ŚCIĘGNY,15.7770925,50.7908626, 79.3, 951.5, 20.74,7.880000000000001,6.720000000000001, 2026-07-17 22:57:28
SZKOŁA PODSTAWOWA W DROŁTOWICACH, , 56-500, DROŁTOWICE,17.59580112646376,51.33562166466934, 90.14999999999999, 984.9, 20.616666666666667,8.591666666666667,7.399999999999999, 2026-07-17 22:57:28
SZKOŁA PODSTAWOWA IM. KAROLA KURPIŃSKIEGO WE WŁOSZAKOWICACH, UL. KAROLA KURPIŃSKIEGO, 64-140, WŁOSZAKOWICE,16.3711235,51.9317237, 76.90833333333333, 996.3083333333334, 23.458333333333332,5.741666666666667,5.741666666666667, 2026-07-17 22:57:28
SZKOŁA PODSTAWOWA Z ODDZIAŁAMI INTEGRACYJNYMI W ŁOMNICY, UL. KARKONOSKA, 58-508, ŁOMNICA,15.8067664,50.8737685, 83.51666666666667, 968.525, 20.958333333333332,7.183333333333334,6.141666666666667, 2026-07-17 22:57:28
SZKOŁA PODSTAWOWA IM. HENRYKA SIENKIEWICZA W KONOPISKACH, UL. SPORTOWA, 42-274, KONOPISKA,19.0078926,50.7263775, 84.72500000000001, 975.7583333333333, 19.724999999999998,4.483333333333333,4.058333333333334, 2026-07-17 22:57:28
SPOŁECZNA SZKOŁA PODSTAWOWA IM. STANISŁAWA MONIUSZKI W KUDOWIE-ZDROJU, UL. SŁONE, 57-350, KUDOWA-ZDRÓJ,16.2426605,50.4427156, 88.35555555555555, 968.0999999999999, 20.9,6.711111111111111,5.733333333333333, 2026-07-17 22:57:28
SZKOŁA PODSTAWOWA NR 13 W ZAWIERCIU, UL. FILARETÓW, 42-400, ZAWIERCIE,19.4911184,50.4934888, 65.75833333333334, 965.0583333333334, 23.875,5.741666666666667,4.966666666666667, 2026-07-17 22:57:28
SZKOŁA PODSTAWOWA NR 8 W ZAWIERCIU, UL. WOJSKA POLSKIEGO, 42-400, ZAWIERCIE,19.4092199,50.486569, 69.49166666666666, 970.8249999999999, 23.25,4.608333333333333,3.933333333333333, 2026-07-17 22:57:28
SZKOŁA PODSTAWOWA NR 4 IM. MIKOŁAJA KOPERNIKA W ZAWIERCIU, UL. POWSTAŃCÓW ŚLĄSKICH, 42-400, ZAWIERCIE,19.4267169,50.4838354, 67.86666666666666, 970.5, 23.441666666666666,5.6,5.058333333333334, 2026-07-17 22:57:28
SZKOŁA PODSTAWOWA NR 7 IM. MARII KONOPNICKIEJ W ZAWIERCIU, UL. OŚWIATOWA, 42-400, ZAWIERCIE,19.5150167,50.4773682, 68.2, 972.5, 23.483333333333334,8.083333333333334,6.858333333333333, 2026-07-17 22:57:28
SZKOŁA PODSTAWOWA NR 3 W ZAWIERCIU, UL. MARII SKŁODOWSKIEJ-CURIE, 42-400, ZAWIERCIE,19.4347172,50.4796517, 63.166666666666664, 969.275, 24.59166666666667,4.308333333333334,3.858333333333333, 2026-07-17 22:57:28
II LICEUM OGÓLNOKSZTAŁCĄCE IM. ADAMA ASNYKA W BIELSKU-BIAŁEJ, UL. JUTRZENKI, 43-300, BIELSKO-BIAŁA,19.0635478,49.8094065, 81.99166666666666, 968.3083333333334, 21.525000000000002,3.091666666666667,2.783333333333333, 2026-07-17 22:57:28
SZKOŁA PODSTAWOWA NR 2 IM. STANISŁAWA SZYMAŃSKIEGO W ZAWIERCIU, UL. MIECZYSŁAWA NIEDZIAŁKOWSKIEGO, 42-400, ZAWIERCIE,19.4166259,50.487743, 50.425000000000004, 970.3833333333333, 28.558333333333334,4.583333333333333,4.083333333333333, 2026-07-17 22:57:28
SZKOŁA PODSTAWOWA NR 1 IM.BPA MARCINA KROMERA W BIECZU, UL. GRODZKA, 38-340, BIECZ,21.252429,49.730338, 67.47500000000001, 977.025, 24.891666666666666,14.533333333333331,13.2, 2026-07-17 22:57:28
SZKOŁA PODSTAWOWA NR 2 IM. JANA PAWŁA II W PORĘBIE, UL. WIEDZY, 42-480, PORĘBA,19.361528,50.489263, 69.075, 971.875, 23.583333333333332,4.416666666666667,3.933333333333333, 2026-07-17 22:57:28
SZKOŁA PODSTAWOWA NR 4 W BIELSKU-BIAŁEJ, UL. EMILII PLATER, 43-300, BIELSKO-BIAŁA,19.0583845,49.8223768, 85.55833333333334, 967.1083333333332, 20.758333333333333,3.683333333333333,3.316666666666666, 2026-07-17 22:57:28
PUBLICZNA SZKOŁA PODSTAWOWA IM. JANA KOCHANOWSKIEGO W DOBRYSZYCACH, UL. LEŚNA, 97-505, DOBRYSZYCE,19.4126126,51.1463112, 82.4, 983.225, 21.85,7.9625,6.675, 2026-07-17 22:57:28
SZKOŁA PODSTAWOWA IM. STANISŁAWA STASZICA W BOBOWEJ, UL. BOHATERÓW BOBOWEJ, 38-350, BOBOWA,20.9509659,49.7102798, 70.19166666666666, 975.3083333333334, 25.433333333333334,18.1,16.283333333333335, 2026-07-17 22:57:28
SZKOŁA PODSTAWOWA W WINOWNIE, UL. SZKOLNA, 42-350, WINOWNO,19.2179609,50.575152, 88.68333333333334, 972.2416666666667, 19.916666666666668,3.208333333333333,2.933333333333333, 2026-07-17 22:57:28
SZKOŁA PODSTAWOWA IM. FRYDERYKA CHOPINA W WOJSZCZYCACH, , 05-180, WOJSZCZYCE,20.6139434,52.494382, 49.30833333333334, 995.1833333333334, 26.683333333333334,12.525,11.241666666666667, 2026-07-17 22:57:28
SZKOŁA PODSTAWOWA IM.MIKOŁAJA KOPERNIKA W ŁĄŻYNIE II, , 87-123, ŁĄŻYN,18.89236,53.0001, 86.36666666666667, 994.9250000000001, 22.233333333333334,14.058333333333332,12.25, 2026-07-17 22:57:28
NIEPUBLICZNA SZKOŁA PODSTAWOWA GALILEO NR 1 W NAKONOWIE, , 87-853, NAKONOWO,19.0568663,52.5562316, 82.34166666666667, 1000.7666666666668, 22.058333333333334,27.375,25.525, 2026-07-17 22:57:28
PUBLICZNA SZKOŁA PODSTAWOWA IM. HELENY I JÓZEFA ŚWIĄTYŃSKICH W OSSALI, , 28-221, OSSALA,21.3789417,50.4840431, 57.93333333333334, 986.8333333333334, 25.891666666666666,14.116666666666667,12.066666666666668, 2026-07-17 22:57:28
SZKOŁA PODSTAWOWA IM. MARII KONOPNICKIEJ W JAMKACH-KORZONKU, , 42-274, KORZONEK,18.9878115,50.712784, 88.625, 974.3833333333333, 19.400000000000002,3.758333333333333,3.133333333333333, 2026-07-17 22:57:28
SZKOŁA PODSTAWOWA NR 54 Z ODDZIAŁAMI INTEGRACYJNYMI W CZĘSTOCHOWIE, UL. JERZEGO KUKUCZKI, 42-224, CZĘSTOCHOWA,19.137204428836377,50.83579253024215, 81.075, 979.2916666666666, 21.391666666666666,3.475,2.858333333333333, 2026-07-17 22:57:28
TECHNIKUM W ZESPOLE SZKÓŁ PONADPODSTAWOWYCH IM. INŻ. JÓZEFA MARKA W MSZANIE DOLNEJ, UL. JÓZEFA MARKA, 34-730, MSZANA DOLNA,20.0783649,49.6670619, 69.98333333333333, 962.1500000000001, 23.883333333333336,28.175,23.71666666666667, 2026-07-17 22:57:28
SZKOŁA PODSTAWOWA IM. JANA PAWŁA II W DĄBIU, UL. 3 MAJA, 62-660, DĄBIE,18.8198211,52.0891079, 88.87, 996.29, 21.919999999999998,8.370000000000001,7.02, 2026-07-17 22:57:28
ZESPÓŁ SZKÓŁ-SZKOŁA PODSTAWOWA W ZEMBRZYCACH, , 34-210, ZEMBRZYCE,19.5620127,49.7784772, 64.60833333333333, 972.8249999999999, 24.825,13.191666666666668,11.7, 2026-07-17 22:57:28
SZKOŁA PODSTAWOWA IM.KAZIMIERZA WIELKIEGO W HUCIE STAREJ B, UL. ADAMA MICKIEWICZA, 42-263, HUTA STARA B,19.138718,50.7370817, 86.97500000000001, 975.1, 20.191666666666666,5.8,4.6, 2026-07-17 22:57:28
III PRYWATNE LICEUM OGÓLNOKSZTAŁCĄCE SZKOŁY OTWARTEGO MYŚLENIA W SOSNOWCU, UL. RACŁAWICKA, 41-200, SOSNOWIEC,19.1040791,50.2862638, 69.77499999999999, 980.6666666666666, 24.099999999999998,6.274999999999999,5.491666666666667, 2026-07-17 22:57:28
SZKOŁA PODSTAWOWA IM.HENRYKA SIENKIEWICZA W KAMIENICY POLSKIEJ, UL. ADAMA FERENSA, 42-260, KAMIENICA POLSKA,19.1305413,50.6705877, 88.91, 975.26, 20.080000000000002,4.26,3.429999999999999, 2026-07-17 22:57:28
SZKOŁA PODSTAWOWA Z ODDZIAŁAMI INTEGRACYJNYMI NR 5 IM. HENRYKA SIENKIEWICZA W MYSZKOWIE, UL. SIKORSKIEGO, 42-300, MYSZKÓW,19.3144637,50.5706845, 73.51818181818182, 973.4636363636364, 22.545454545454547,5.172727272727273,4.245454545454546, 2026-07-17 22:57:28
SZKOŁA PODSTAWOWA IM. JANA PAWŁA II W PISANICY, , 19-314, PISANICA,22.5789816,53.8232701, 61.68333333333334, 994.3666666666667, 24.383333333333336,12.333333333333334,10.733333333333334, 2026-07-17 22:57:28
TECHNIKUM W ZESPOLE SZKÓŁ IM. BOHATERÓW WESTERPLATTE W JABŁONCE, UL. PODHALAŃSKA, 34-480, JABŁONKA,19.69526927,49.47987225, 69.00833333333334, 938.5333333333333, 23.900000000000002,24.34166666666667,24.058333333333334, 2026-07-17 22:57:28
SZKOŁA PODSTAWOWA W BACZYNIE, , 34-211, BACZYN,19.7182581,49.7900852, 68.29166666666667, 963.5416666666666, 23.65833333333333,10.0,8.924999999999999, 2026-07-17 22:57:28
SZKOŁA PODSTAWOWA IM. ŚW. FRANCISZKA Z ASYŻU W JELNEJ, , 37-310, JELNA,22.3518669,50.2962689, 60.96666666666667, 989.5166666666668, 26.108333333333334,19.125,18.541666666666668, 2026-07-17 22:57:28
BRANŻOWA SZKOŁA I STOPNIA NR 3 W TARNOWSKICH GÓRACH, UL. HENRYKA SIENKIEWICZA, 42-600, TARNOWSKIE GÓRY,18.8608006,50.4472968, 92.13333333333333, 977.9583333333334, 19.95,3.583333333333333,3.975, 2026-07-17 22:57:28
PUBLICZNA SZKOŁA PODSTAWOWA W KRZESZOWIE GÓRNYM, , 37-413, KRZESZÓW GÓRNY,22.384137,50.419185, 70.81666666666666, 988.3416666666667, 23.191666666666666,16.89166666666667,15.633333333333333, 2026-07-17 22:57:28
I LICEUM OGÓLNOKSZTAŁCĄCE Z ODDZIAŁAMI DWUJĘZYCZNYMI IM. POWSTAŃCÓW ŚLĄSKICH W RYBNIKU, UL. TADEUSZA KOŚCIUSZKI, 44-200, RYBNIK,18.5519661,50.097143, 80.97500000000001, 980.4250000000001, 21.724999999999998,3.199999999999999,2.891666666666667, 2026-07-17 22:57:28
SZKOŁA PODSTAWOWA Z ODDZIAŁAMI MISTRZOSTWA SPORTOWEGO NR 9 IM. ADAMA MICKIEWICZA W RYBNIKU, UL. CMENTARNA, 44-200, RYBNIK,18.541821,50.097862, 84.66363636363636, 981.7636363636364, 20.981818181818184,3.372727272727273,2.836363636363636, 2026-07-17 22:57:28
II LICEUM OGÓLNOKSZTAŁCĄCE IM. STANISŁAWA WYSPIAŃSKIEGO W BĘDZINIE, UL. TEATRALNA, 42-500, BĘDZIN,19.1387173,50.3262993, 79.07000000000001, 977.89, 22.57,5.21,4.27, 2026-07-17 22:57:28
SZKOŁA PODSTAWOWA NR 8 IM. KAWALERÓW ORDERU UŚMIECHU W ŚWIDNICY, UL. WAŁBRZYSKA, 58-100, ŚWIDNICA,16.4766735,50.8345375, 78.125, 979.3916666666668, 22.84166666666667,6.6,5.333333333333333, 2026-07-17 22:57:28
SZKOŁA PODSTAWOWA W WIADROWIE, , 59-411, WIADRÓW,16.177058,50.978719, 69.325, 981.3000000000001, 24.041666666666668,5.575,5.575, 2026-07-17 22:57:28
SZKOŁA PODSTAWOWA NR 30 W ZABRZU, UL. LUDWIKI WAWRZYŃSKIEJ, 41-813, ZABRZE,18.8038211,50.3787192, 87.0, 975.4250000000001, 20.325,3.916666666666666,3.658333333333333, 2026-07-17 22:57:28
SZKOŁA PODSTAWOWA NR 28 IM. MIŁOŚNIKÓW ROKITNICY W ZABRZU, UL. IRENY KOSMOWSKIEJ, 41-813, ZABRZE,18.6721773,50.293402, 91.925, 976.775, 20.383333333333333,3.733333333333333,3.108333333333333, 2026-07-17 22:57:28
SZKOŁA PODSTAWOWA W BORECZNIE, , 14-230, BORECZNO,19.6819503,53.785392, 54.05833333333334, 993.3083333333333, 26.333333333333332,8.333333333333334,8.075000000000001, 2026-07-17 22:57:28
SZKOŁA PODSTAWOWA NR 3 IM. JANA KOCHANOWSKIEGO W TYCHACH, UL. WOJSKA POLSKIEGO, 43-100, TYCHY,18.967428851534244,50.13334989635492, 81.64, 979.72, 21.97,5.96,5.64, 2026-07-17 22:57:28
SZKOŁA PODSTAWOWAW IM. HENRYKA SIENKIEWICZA W KOŚCIELCU, , 59-223, KOŚCIELEC,16.13685,51.14836, 62.175000000000004, 988.2416666666667, 25.233333333333334,5.774999999999999,4.85, 2026-07-17 22:57:28
SZKOŁA PODSTAWOWA Z ODDZIAŁAMI INTEGRACYJNYMI NR 34 IM. IRENY SENDLEROWEJ W RYBNIKU, UL. WŁADYSŁAWA STANISŁAWA REYMONTA, 44-200, RYBNIK,18.52614,50.09058, 87.54166666666667, 979.4, 20.533333333333335,3.675,3.141666666666667, 2026-07-17 22:57:28
SZKOŁA PODSTAWOWA NR 1 IM. STANISŁAWY ŁAKOMIK W CZELADZI, UL. WŁADYSŁAWA REYMONTA, 41-250, CZELADŹ,19.073488,50.3091799, 81.7, 978.6416666666668, 22.508333333333336,6.716666666666666,5.583333333333333, 2026-07-17 22:57:28
SZKOŁA PODSTAWOWA NR 5 W CZELADZI, UL. LWOWSKA, 41-253, CZELADŹ,19.092371,50.3074791, 82.68333333333334, 976.3249999999999, 22.183333333333334,6.433333333333334,5.891666666666668, 2026-07-17 22:57:28
SZKOŁA PODSTAWOWA NR 2 IM. JANA PAWŁA II W ŚWIERADOWIE-ZDROJU, UL. SANATORYJNA, 59-850, ŚWIERADÓW-ZDRÓJ,15.3071925,50.9269757, 71.6888888888889, 956.0999999999999, 20.766666666666666,3.477777777777778,3.2, 2026-07-17 22:57:28
TECHNIKUM NR 2 W ZESPOLE SZKÓŁ BUDOWLANYCH IM. GENERAŁA STANISŁAWA MACZKA W BIELSKU-BIAŁEJ, UL. BUDOWLANYCH, 43-300, BIELSKO-BIAŁA,19.0578358,49.7952988, 86.13333333333334, 975.2666666666667, 21.288888888888888,3.833333333333333,3.355555555555555, 2026-07-17 22:57:28
SZKOŁA PODSTAWOWA ZGROMADZENIA CÓREK BOŻEJ MIŁOŚCI IM. FRANCISZKI LECHNER W BIELSKU-BIAŁEJ, UL. WŁADYSŁAWA BRONIEWSKIEGO, 43-300, BIELSKO-BIAŁA,19.054075,49.819524, 78.53636363636363, 975.1363636363636, 21.463636363636365,2.581818181818181,2.581818181818181, 2026-07-17 22:57:28
SZKOŁA PODSTAWOWA NR 6 SPECJALNA IM. PROF. MARII GRZEGORZEWSKIEJ W CZELADZI, UL. SZPITALNA, 41-250, CZELADŹ,19.0754521,50.3289091, 80.95, 976.7333333333332, 21.941666666666666,5.183333333333334,4.758333333333334, 2026-07-17 22:57:28
SAMORZĄDOWA SZKOŁA PODSTAWOWA IM. STEFANA BATOREGO W LIWIE , UL. KS. K. R. LESZCZYŃSKIEGO, 07-100, LIW,21.9631846,52.3725265, 64.61666666666666, 996.4666666666667, 25.758333333333336,11.25,9.725, 2026-07-17 22:57:28
SZKOŁA PODSTAWOWA IM. HELENY MARUSARZÓWNY W ZĘBIE, UL. ŚW. ANNY, 34-521, ZĄB,19.9474975,49.3379768, 59.775, 963.0333333333333, 23.150000000000002,13.408333333333331,13.133333333333333, 2026-07-17 22:57:28
LICEUM OGÓLNOKSZTAŁACĄCE IM. PROF. ZBIGNIEWA RELIGI W GILOWICACH, UL. WOJCIECHA KORFANTEGO, 43-227, GILOWICE,19.3085572,49.7122409, 80.99166666666666, 983.3000000000001, 22.15833333333333,6.35,5.516666666666668, 2026-07-17 22:57:28
SZKOŁA PODSTAWOWA W CZERNICY, , 58-521, CZERNICA,17.2449367,51.0457859, 87.075, 971.55, 21.175,6.575,5.55, 2026-07-17 22:57:28
SZKOŁA PODSTAWOWA NR 3 IM. JANA PAWŁA II W SIEMIATYCZACH, UL. GEN. WŁADYSŁAWA ANDERSA, 17-300, SIEMIATYCZE,22.8845728,52.4289637, 52.93333333333334, 990.625, 25.258333333333336,12.75,11.033333333333331, 2026-07-17 22:57:28
SZKOŁA PODSTAWOWA IM.KARDYNAŁA STEFANA WYSZYŃSKIEGO W SIEDLISKACH, , 33-172, SIEDLISKA,21.0117541,49.8686222, 71.2, 979.9399999999999, 24.7,16.45,14.14, 2026-07-17 22:57:28
NIEPUBLICZNE LICEUM SZTUK PLASTYCZNYCH IM. ORLĄT LWOWSKICH W TYCHACH, UL. BUDOWLANYCH, 43-100, TYCHY,19.0200022,50.1218007, 85.3, 979.325, 21.0875,5.3875,4.5, 2026-07-17 22:57:28
LICEUM OGÓLNOKSZTAŁCĄCE IM. HENRYKA SIENKIEWICZA W BOBOWEJ, UL. DŁUGOSZOWSKICH, 38-350, BOBOWA,20.9509659,49.7102798, 73.24166666666666, 974.8916666666668, 24.766666666666666,18.141666666666666,15.483333333333334, 2026-07-17 22:57:28
SZKOŁA PODSTAWOWA NR 1 IM. JANA III SOBIESKIEGO W LIBIĄŻU, UL. SZKOLNA, 32-590, LIBIĄŻ,19.3286373,50.1013661, 79.875, 978.7166666666667, 21.916666666666668,73.85833333333333,68.25, 2026-07-17 22:57:28
TECHNIKUM NR 2 W ZESPOLE SZKÓŁ NR 2 IM.ŚW.JADWIGI KRÓLOWEJ W ANDRYCHOWIE , UL. STEFANA BATOREGO, 34-120, ANDRYCHÓW,19.3412842,49.8548934, 92.93333333333334, 971.9, 22.349999999999998,4.5,3.608333333333333, 2026-07-17 22:57:28
SZKOŁA PODSTAWOWA IM. ZBIGNIEWA WODECKIEGO W PIORUNCE, , 33-380, PIORUNKA,20.9906818,49.4898945, 72.57272727272726, 948.4363636363636, 21.781818181818185,11.163636363636364,10.918181818181818, 2026-07-17 22:57:28
SZKOŁA PODSTAWOWA NR 7 IM. KS. STANISŁAWA STASZICA W JAROSŁAWIU, UL. DOLNOLEŻAJSKA, 37-500, JAROSŁAW,22.680698,50.044337, 53.65, 987.7833333333333, 28.099999999999998,14.95,13.35, 2026-07-17 22:57:28
SZKOŁA PODSTAWOWA IM.MARSZAŁKA JÓZEFA PIŁSUDSKIEGO W GĄSKACH, , 19-400, GĄSKI,15.921626,54.236797, 66.31666666666666, 991.775, 23.96666666666667,12.35,10.716666666666669, 2026-07-17 22:57:28
II LICEUM OGÓLNOKSZTAŁCĄCE Z DODATKOWĄ NAUKĄ JĘZYKA BIAŁORUSKIEGO W HAJNÓWCE, UL. MARSZAŁKA JÓZEFA PIŁSUDSKIEGO, 17-200, HAJNÓWKA,23.592226,52.735871, 53.21666666666667, 992.6500000000001, 25.491666666666664,13.483333333333334,12.983333333333334, 2026-07-17 22:57:28
TECHNIKUM W KĘTACH ZAKŁADU DOSKONALENIA ZAWODOWEGO W KATOWICACH, UL. ŻWIRKI I WIGURY, 32-650, KĘTY,19.2228003,49.8807299, 68.44166666666666, 978.625, 22.925,2.5666666666666678,2.5666666666666678, 2026-07-17 22:57:28
SPOŁECZNA SZKOŁA PODSTAWOWA Z ODDZIAŁAMI DWUJĘZYCZNYMI IM. JERZEGO KUKUCZKI W RYBNIKU, UL. ŚW. JÓZEFA, 44-217, RYBNIK,18.53180821106009,50.10136552503232, 85.74166666666667, 982.4499999999999, 20.558333333333334,3.05,2.766666666666667, 2026-07-17 22:57:28
SZKOŁA PODSTAWOWA NR 8 IM. WŁADYSŁAWA WEBERA W ZESPOLE SZKOLNO-PRZEDSZKOLNYM Z ODDZIAŁAMI INTEGRACYJNYMI NR 1 W RYBNIKU, UL. GLIWICKA, 44-207, RYBNIK,18.55022,50.12254, 83.875, 979.9833333333332, 21.224999999999998,3.449999999999999,3.083333333333333, 2026-07-17 22:57:28
SZKOŁA PODSTAWOWA NR 32 IM. ALFREDA SZKLARSKIEGO W RYBNIKU, UL. BORKI, 44-200, RYBNIK,18.5162417,50.1108233, 85.8, 981.4166666666666, 20.658333333333335,4.149999999999999,3.4916666666666663, 2026-07-17 22:57:28
TECHNIKUM NR 2 W RYBNIKU, UL. TADEUSZA KOŚCIUSZKI, 44-200, RYBNIK,18.5490429,50.0946384, 83.47500000000001, 980.9166666666666, 20.849999999999998,3.291666666666666,2.925, 2026-07-17 22:57:28
SZKOŁA PODSTAWOWA NR 1 IM. TADEUSZA KOŚCIUSZKI W NOWEJ SOLI, UL. SZKOLNA, 67-100, NOWA SÓL,15.71707,51.80344, 62.041666666666664, 999.5916666666667, 26.266666666666666,6.408333333333334,5.558333333333334, 2026-07-17 22:57:28
SZKOŁA PODSTAWOWA IM. ZOFII KOSSAK W PIERŚĆCU, UL. JERZEGO TOMANKA, 43-430, PIERŚCIEC,18.8202885,49.8369, 86.25833333333333, 977.1083333333332, 21.175,2.775,2.3, 2026-07-17 22:57:28
SZKOŁA PODSTAWOWA Z ODDZIAŁAMI INTEGRACYJNYMI NR 1 IM. JANUSZA KORCZAKA W RYBNIKU, UL. BOLESŁAWA CHROBREGO, 44-200, RYBNIK,18.54937,50.09286, 81.2, 980.225, 21.991666666666664,2.975,2.708333333333333, 2026-07-17 22:57:28
SZKOŁA PODSTAWOWA IM. JANA PAWŁA II W PSARACH, UL. GŁÓWNA, 42-287, PSARY,19.1137897,50.3794553, 95.22500000000001, 972.3666666666667, 19.64166666666667,4.149999999999999,3.433333333333333, 2026-07-17 22:57:28
LICEUM OGÓLNOKSZTAŁCĄCE IM. GEN. WŁADYSŁAWA ANDERSA W ŻAGANIU, UL. GIMNAZJALNA, 68-100, ŻAGAŃ,15.3248642,51.6151339, 60.80833333333334, 994.8166666666666, 24.608333333333334,12.558333333333332,10.725, 2026-07-17 22:57:28
LICEUM OGÓLNOKSZTAŁCĄCE Z ODDZIAŁAMI DWUJĘZYCZNYMI W SZPROTAWIE, UL. NIEPODLEGŁOŚCI, 67-300, SZPROTAWA,15.5298967,51.5647296, 59.96666666666667, 992.5916666666667, 24.575,4.241666666666666,3.675, 2026-07-17 22:57:28
TECHNIKUM NR 1 IM. STANISŁAWA STASZICA W RYBNIKU, UL. TADEUSZA KOŚCIUSZKI, 44-200, RYBNIK,18.5456179,50.0967328, 85.77499999999999, 980.0833333333334, 20.616666666666667,3.508333333333333,3.166666666666666, 2026-07-17 22:57:28
SZKOŁA PODSTAWOWA NR 6 IM. JANUSZA KORCZAKA W ZAWIERCIU, UL. WIERZBOWA, 42-400, ZAWIERCIE,19.4166259,50.487743, 67.8, 970.6, 23.349999999999998,5.633333333333333,4.675, 2026-07-17 22:57:28
SZKOŁA PODSTAWOWA SPECJALNA W DOBRODZIENIU, UL. PIASTOWSKA, 46-380, DOBRODZIEŃ,18.44702463,50.72184475, 90.99166666666666, 982.1083333333332, 20.158333333333335,5.524999999999999,4.875, 2026-07-17 22:57:28
SZKOŁA PODSTAWOWA IM. JANA PAWŁA II W JONINACH, , 33-160, JONINY,21.1750307,49.8859362, 76.05, 1097.8, 22.741666666666664,11.566666666666668,9.85, 2026-07-17 22:57:28
SZKOŁA PODSTAWOWA NR 19 W RYBNIKU, UL. WŁOŚCIAŃSKA, 44-251, RYBNIK,18.62631,50.05483, 83.58333333333333, 978.5, 20.724999999999998,4.524999999999999,3.941666666666666, 2026-07-17 22:57:28
ZESPÓŁ SZKÓŁ SAMORZĄDOWYCH W HOCZWI SZKOŁA PODSTAWOWA W HOCZWI, , 38-604, HOCZEW,22.3277466,49.4275648, 77.04166666666667, 971.9583333333334, 22.675,33.075,28.891666666666666, 2026-07-17 22:57:28
EUROPEJSKIE LICEUM SŁUŻB MUNDUROWYCH WE WROCŁAWIU, UL. KRUSZWICKA, 53-652, WROCŁAW-STARE MIASTO,17.00897301250473,51.11399445590569, 75.13, 993.97, 24.05,6.609999999999999,6.12, 2026-07-17 22:57:28
SZKOŁA PODSTAWOWA W NIEBIESZCZANACH, , 38-504, NIEBIESZCZANY,22.1593098,49.5008701, 72.44166666666666, 967.4666666666667, 23.116666666666664,27.041666666666668,24.4, 2026-07-17 22:57:28
SZKOŁA PODSTAWOWA IM. ŚWIĘTEGO ANDRZEJA BOBOLI W KOSTAROWCACH, , 38-507, KOSTAROWCE,22.1133372,49.5876781, 72.5, 973.8916666666668, 23.616666666666664,23.08333333333333,19.375, 2026-07-17 22:57:28
BRANŻOWA SZKOŁA I STOPNIA SPECJALNA W RYBNIKU, UL. STANISŁAWA MAŁACHOWSKIEGO, 44-251, RYBNIK,18.5866335,50.052555, 89.76666666666667, 979.0416666666666, 19.883333333333333,3.091666666666667,2.833333333333333, 2026-07-17 22:57:28
