NAME,STREET,POST_CODE,CITY,LONGITUDE,LATITUDE,HUMIDITY_AVG,PRESSURE_AVG,TEMPERATURE_AVG,PM10_AVG,PM25_AVG,TIMESTAMP
SZKOŁA PODSTAWOWA IM. MARIANA FALSKIEGO W KRASZEWICACH, UL. SZKOLNA, 63-522, KRASZEWICE,18.22403,51.51563, 0.1, 999.3666666666667, 0.0,11.8,5.7, 2026-07-17 22:57:28
SZKOŁA PODSTAWOWA WE WRZĄSOWICACH, UL. SZKOLNA, 32-040, WRZĄSOWICE,19.94282,49.96103, 54.175000000000004, 972.3249999999999, 27.366666666666664,11.808333333333332,10.575, 2026-07-17 22:57:28
ZESPÓŁ SZKÓŁ NR 1 W PSZCZYNIE, UL. KAZIMIERZA WIELKIEGO, 43-200, PSZCZYNA,18.9457058,49.965883, 94.96666666666665, 995.4, 21.366666666666664,2.6,1.373333333333333, 2026-07-17 22:57:28
ZESPÓŁ SZKÓŁ IM. POWSTAŃCÓW WIELKOPOLSKICH W JANKOWIE PRZYGODZKIM, SZKOLNA, 63-421, JANKÓW PRZYGODZKI,17.7889069,51.596172, 99.90000000000002, 992.4, 16.4,21.3,11.15, 2026-07-17 22:57:28
SZKOŁA PODSTAWOWA NR 7 IM. ŻOŁNIERZY WRZEŚNIA W ĆWIKLICACH, UL. MĘCZENNIKÓW OŚWIĘCIMSKICH, 43-229, ĆWIKLICE,18.989839,49.971937, 85.06666666666666, 981.6666666666666, 23.3,6.533333333333334,3.923333333333333, 2026-07-17 22:57:28
SZKOŁA PODSTAWOWA NR 12 W STUDZIONCE, UL. JORDANA, 43-245, STUDZIONKA,18.774985,49.9603559, 95.13333333333333, 987.9666666666667, 20.46666666666667,3.333333333333333,1.876666666666666, 2026-07-17 22:57:28
ZESPÓŁ SZKOLNO-PRZEDSZKOLNY W PIASKU, SZKOLNA, 43-211, PIASEK,18.94634,50.00955, 81.23333333333333, 990.0333333333333, 22.099999999999998,5.533333333333334,3.066666666666666, 2026-07-17 22:57:28
ZESPÓŁ SZKOLNO-PRZEDSZKOLNY W ŁĄCE, FITELBERGA, 43-241, ŁĄKA,18.906757,49.9582444, 99.90000000000002, 987.1333333333333, 20.099999999999998,3.6999999999999993,2.11, 2026-07-17 22:57:28
SZKOŁA PODSTAWOWA NR 3 W LUBONIU, ARMII POZNAŃ, 62-030, LUBOŃ,16.8968,52.3481, 95.53333333333335, 986.0333333333333, 22.0,4.466666666666666,2.6999999999999997, 2026-07-17 22:57:28
ZESPÓŁ SZKÓŁ PONADGIMNAZJALNYCH CENTRUM KSZTAŁCENIA USTAWICZNEGO W PRZYGODZICACH, PTR, 63-421, PRZYGODZICE,17.822685,51.59023, 89.76666666666667, 1002.6, 19.366666666666667,6.633333333333333,3.783333333333333, 2026-07-17 22:57:28
LICEUM OGÓLNOKSZTAŁCĄCE IM. WŁADYSŁAWA JAGIEŁŁY W ODOLANOWIE, KROTOSZYŃSKA, 63-430, ODOLANÓW,17.66024,51.58063, 99.90000000000002, 994.3333333333334, 20.066666666666666,13.566666666666668,7.489999999999999, 2026-07-17 22:57:28
ZESPÓŁ SZKÓŁ W PIOTROWIE, , 62-814, PIOTRÓW,18.05485,51.8157, 99.90000000000002, 995.9, 19.833333333333332,7.033333333333334,3.98, 2026-07-17 22:57:28
SZKOŁA PODSTAWOWA W CZARNYMLESIE, , 63-421, CZARNYLAS,17.762604,51.508366, 78.26666666666667, 990.1999999999999, 22.099999999999998,1.5999999999999992,0.87, 2026-07-17 22:57:28
SZKOŁA PODSTAWOWA NR 2 IM. AUGUSTA HR. CIESZKOWSKIEGO W LUBONIU, ŻABIKOWSKA, 62-030, LUBOŃ,16.878431,52.346672, 82.56666666666666, 1000.2333333333332, 22.900000000000002,5.566666666666666,3.113333333333333, 2026-07-17 22:57:28
SZKOŁA PODSTAWOWA IM. POWSTAŃCÓW WIELKOPOLSKICH W DORUCHOWIE, KALISKA, 63-505, DORUCHÓW,18.0786,51.4189, 86.39999999999999, 1014.5, 22.03333333333333,5.766666666666668,3.743333333333333, 2026-07-17 22:57:28
SZKOŁA PODSTAWOWA IM. MIKOŁAJA KOPERNIKA W BUKOWCU, SZKOLNA, 95-006, BUKOWIEC,19.6757,51.6918, 62.199999999999996, 980.1333333333333, 26.933333333333334,8.166666666666666,4.686666666666666, 2026-07-17 22:57:28
SZKOŁA PODSTAWOWA IM. MARII KONOPNICKIEJ W KOTLINIE, MARII KONOPNICKIEJ, 63-220, KOTLIN,17.645437,51.91866, 99.90000000000002, 992.2333333333332, 20.766666666666666,0.066666666666666,0.033333333333333, 2026-07-17 22:57:28
SZKOŁA PODSTAWOWA NR 2 W OTMUCHOWIE, KALINOWA, 48-385, OTMUCHÓW,17.213,50.46535, 99.90000000000002, 990.3666666666667, 20.3,11.433333333333332,6.62, 2026-07-17 22:57:28
SZKOŁA PODSTAWOWA IM. BOHATERÓW POWSTAŃ ŚLĄSKICH W KAŁKOWIE, , 48-364, KAŁKÓW,17.185241,50.4042, 89.93333333333334, 985.8333333333334, 19.966666666666665,6.633333333333333,3.543333333333333, 2026-07-17 22:57:28
SZKOŁA PODSTAWOWA W MACIEJOWICACH, , 48-385, MACIEJOWICE,17.13497,50.4998, 99.90000000000002, 976.5666666666666, 20.433333333333334,3.566666666666666,2.1, 2026-07-17 22:57:28
TEST SZKOŁA, ul Testowa, 00-000, TESTCITY,-157.52969778504766,1.8586845937815497, 69.46666666666667, 994.4, 23.96666666666667,2.133333333333333,1.086666666666666, 2026-07-17 22:57:28
ZESPÓŁ EDUKACYJNY W KONOTOPIE, PL. POWSTAŃCÓW WIELKOPOLSKICH, 67-416, KONOTOP,15.9031,51.93023, 81.43333333333334, 1000.6666666666666, 23.46666666666667,9.833333333333334,4.886666666666667, 2026-07-17 22:57:28
PRZEDSZKOLE NR 6 W BOCHNI, MUROWIANKA, 32-700, BOCHNIA,20.4415,49.96533, 64.36666666666666, 997.0333333333333, 26.833333333333332,14.833333333333334,9.153333333333334, 2026-07-17 22:57:28
PUBLICZNA SZKOŁA PODSTAWOWA W SZYMISZOWIE, SZKOLNA, 47-161, SZYMISZÓW,18.21983,50.53656, 87.0, 988.9666666666667, 19.433333333333334,9.933333333333334,5.666666666666667, 2026-07-17 22:57:28
PUBLICZNA SZKOŁA PODSTAWOWA W ROZMIERCE, SZKOLNA, 47-171, ROZMIERKA,18.26905,50.56072, 1.266666666666666, 1016.5666666666666, 21.5,6.666666666666667,3.933333333333333, 2026-07-17 22:57:28
SZKOŁA PODSTAWOWA IM. ORŁA BIAŁEGO W KUROWICACH FILIA W WOLI RAKOWEJ, SZKOLNA, 95-006, WOLA RAKOWA,19.61157,51.67447, 57.0, 986.4, 26.900000000000002,2.5,1.49, 2026-07-17 22:57:28
SZKOŁA PODSTAWOWA NR 8 IM. JÓZEFA WESZKI W RUDOŁTOWICACH, KRZYWOŃ, 43-220, RUDOŁTOWICE,19.00171,49.95711, 99.86666666666667, 991.6333333333333, 22.5,2.166666666666666,1.033333333333333, 2026-07-17 22:57:28
ZESPÓŁ SZKOLNO-PRZEDSZKOLNY W WIŚLE WIELKIEJ, HODOWCÓW, 43-243, WISŁA WIELKA,18.8532,49.95291, 99.90000000000002, 984.8000000000001, 20.766666666666666,2.8,1.706666666666666, 2026-07-17 22:57:28
SZKOŁA PODSTAWOWA IM. MARKA PRAWEGO W JEMIELNICY, SZKOLNA, 47-133, JEMIELNICA,18.380122,50.548993, 99.90000000000002, 991.0666666666666, 21.033333333333335,8.1,4.106666666666666, 2026-07-17 22:57:28
SZKOŁA PODSTAWOWA NR 2 IM. ŚW. JADWIGI ŚLĄSKIEJ W PSZCZYNIE, KATOWICKA, 43-200, PSZCZYNA,18.947994,49.992568, 91.3, 988.9666666666667, 21.599999999999998,2.5,1.243333333333333, 2026-07-17 22:57:28
ZESPÓŁ SZKÓŁ SPECJALNYCH W OSTROWCU ŚWIĘTOKRZYSKIM, IŁZECKA, 27-400, OSTROWIEC ŚWIĘTOKRZYSKI,21.386931,50.942931, 99.90000000000002, 1001.6999999999999, 26.8,18.23333333333333,11.3, 2026-07-17 22:57:28
ZESPÓŁ SZKOLNO-PRZEDSZKOLNY W JANKOWICACH, BAZIOWA, 43-215, JANKOWICE,18.989423,50.002529, 29.0, 936.9, 23.3,28.0,17.0, 2026-07-17 22:57:28
SZKOŁA PODSTAWOWA NR 4 IM. JÓZEFA PUKOWCA W PSZCZYNIE, ZYGMUNTA KRASIŃSKIEGO, 43-200, PSZCZYNA,18.961125,49.971182, 72.7, 984.4333333333334, 23.400000000000002,7.466666666666666,4.246666666666667, 2026-07-17 22:57:28
ZESPÓŁ SZKÓŁ W OTMUCHOWIE, KRAKOWSKA, 48-385, OTMUCHÓW,17.167634,50.4705, 86.73333333333333, 982.6999999999999, 22.066666666666666,5.166666666666667,2.643333333333333, 2026-07-17 22:57:28
SZKOŁA PODSTAWOWA NR 60IM. IGNACEGO ŁUKASZEWICZA W CZECHOWICACH-DZIEDZICACH, UL. ŁUKASIEWICZA, 43-502, CZECHWICE-DZIEDZICE,19.016493,49.899404, 90.3, 975.7666666666668, 21.633333333333336,1.966666666666666,1.043333333333333, 2026-07-17 22:57:28
SZKOŁA PODSTAWOWA NR 4 IM. GUSTAWA MORCINKA W SŁUPSKU, UL. LESZCZYŃSKIEGO, 76-200, SŁUPSK,17.005017,54.475286, 90.93333333333334, 1003.5333333333333, 19.266666666666666,9.066666666666668,5.32, 2026-07-17 22:57:28
SZKOŁA PODSTAWOWA W KLESZCZOWIE, UL. SZKOLNA, 44-164, KLESZCZÓW,18.52751,50.344057, 61.9, 992.9, 21.2,0.0,0.0, 2026-07-17 22:57:28
SZKOŁA PODSTAWOWA NR 5 IM. GRYFITÓW W SŁUPSKU, UL. HUBALCZYKÓW, 76-200, SŁUPSK,17.062723,54.455744, 89.76666666666667, 1002.6, 19.366666666666667,6.633333333333333,3.783333333333333, 2026-07-17 22:57:28
ZESPÓŁ SZKOLNO-PRZEDSZKOLNY W POTĘPIE, UL. TARNOGÓRSKA, 42-693, POTĘPA,18.662519,50.565309, 99.90000000000002, 1006.8000000000001, 18.766666666666666,1.8,0.95, 2026-07-17 22:57:28
SZKOŁA PODSTAWOWA NR 3 IM. JANA PAWŁA II W PSZCZYNIE, UL. STAROMIEJSKA, 43-200, PSZCZYNA,18.92452,49.98849, 75.08333333333333, 981.4583333333334, 22.224999999999998,4.558333333333334,3.933333333333333, 2026-07-17 22:57:28
SZKOŁA PODSTAWOWA IM. MIKOŁAJA REJA W GORZYCZKACH, UL. WIEJSKA, 44-350, GORZYCZKI,18.399689,49.944774, 99.90000000000002, 981.7666666666668, 19.3,0.5,0.273333333333333, 2026-07-17 22:57:28
SZKOŁA PODSTAWOWA NR 6 IM. LUDWIKA WARYŃSKIEGO W SŁUPSKU, UL. STARZYŃSKIEGO, 76-200, SŁUPSK,17.023811,54.46598, 99.90000000000002, 1007.3000000000001, 20.5,2.6999999999999997,1.509999999999999, 2026-07-17 22:57:28
SZKOŁA PODSTAWOWA IM. JANA BRZECHWY W KOBIÓRZE, UL. TUWIMA, 43-210, KOBIÓR,18.930274,50.060752, 5.0, 985.6666666666666, 22.066666666666666,9.2,5.023333333333333, 2026-07-17 22:57:28
SZKOŁA PODSTAWOWA W PONISZOWICACH, UL. GLIWICKA, 44-172, PONISZOWICE,18.458674,50.40922, 99.90000000000002, 982.8333333333334, 21.766666666666666,1.9,1.076666666666666, 2026-07-17 22:57:28
SZKOŁA PODSTAWOWA IM. ORŁA BIAŁEGO W SOKOŁOWICACH, SOKOŁOWICE, 56-400, SOKOŁOWICE,17.4469,51.245, 82.33333333333333, 988.3666666666667, 22.133333333333336,22.266666666666666,13.68, 2026-07-17 22:57:28
SZKOŁA PODSTAWOWA IM. UNICEF W LIGOCIE MAŁEJ, LIGOTA MAŁA, 56-400, LIGOTA MAŁA,17.365476,51.142467, 65.76666666666667, 968.4, 24.166666666666668,21.1,12.85, 2026-07-17 22:57:28
SZKOŁA PODSTAWOWA GMINY OLEŚNICA W OLEŚNICY, WILEŃSKA, 56-400, OLEŚNICA,17.41034,51.2095, 99.90000000000002, 998.8666666666667, 22.46666666666667,14.333333333333334,7.53, 2026-07-17 22:57:28
SZKOŁA PODSTAWOWA NR 19 W BRZEŹCACH, POKOJU, 43-200, BRZEŹCE,18.832539,49.984943, 84.56666666666666, 984.0666666666666, 20.8,3.033333333333333,1.5999999999999992, 2026-07-17 22:57:28
ZESPÓŁ SZKOLNO-PRZEDSZKOLNY W RADOSTOWIE ŚREDNIM, RADOSTÓW ŚREDNI, 59-800, RADOSTÓW ŚREDNI,15.36293,51.12153, 27.5, 983.0, 28.3,0.5,0.28, 2026-07-17 22:57:28
ZESPÓŁ SZKOLNO-PRZEDSZKOLNY W KOŚCIELNIKU, KOŚCIELNIK, 59-800, KOŚCIELNIK,15.29682,51.08393, 61.9, 995.9, 17.5,0.3,0.15, 2026-07-17 22:57:28
SZKOŁA PODSTAWOWA IM. POLSKICH ODKRYWCÓW I PODRÓŻNIKÓW W KOBIERZYCACH, PARKOWA, 55-040, KOBIERZYCE,16.933169,50.971851, 67.93333333333334, 984.4333333333334, 22.0,3.1,1.903333333333333, 2026-07-17 22:57:28
SZKOŁA PODSTAWOWA IM. UNICEF W BIELANACH WROCŁAWSKICH, AKACJOWA, 55-040, BIELANY WROCŁAWSKIE,16.971022,51.03812, 85.93333333333334, 994.6999999999999, 22.2,10.933333333333332,6.016666666666667, 2026-07-17 22:57:28
SZKOŁA PODSTAWOWA IM. JANUSZA KORCZAKA W WYSOKIEJ, CHABROWA, 52-200, WYSOKA,17.007729,51.047504, 99.90000000000002, 989.8666666666667, 24.933333333333334,5.433333333333334,3.223333333333333, 2026-07-17 22:57:28
SZKOŁA PODSTAWOWA IM. TADEUSZA MAZOWIECKIEGO W TYŃCU MAŁYM, SZKOLNA, 55-040, TYNIEC MAŁY,16.909195,51.0216, 67.8, 1019.16, 2.5,39.96,21.93, 2026-07-17 22:57:28
SZKOŁA PODSTAWOWA IM. ROMUALDA TRAUGUTTA W PUSTKOWIE ŻURAWSKIM, KOLEJOWA, 55-040, PUSTKÓW ŻURAWSKI,16.859465,50.958878, 99.90000000000002, 988.3333333333334, 23.433333333333334,9.9,5.48, 2026-07-17 22:57:28
SZKOŁA PODSTAWOWA NR 1 IM. MARII KONOPNICKIEJ W ZESPOLE SZKÓŁ OGÓLNOKSZTAŁCĄCYCH NR 1 IM. MARII KONOPNICKIEJ W PRUSZCZU GDAŃSKIM, NIEMCEWICZA, 83-000, PRUSZCZ GDAŃSKI,18.650575,54.261512, 74.5, 1015.9333333333334, 24.433333333333334,14.7,8.953333333333333, 2026-07-17 22:57:28
SZKOŁA PODSTAWOWA NR 2 IM. MIKOŁAJA KOPERNIKA W PRUSZCZU GDAŃSKIM, TYSIĄCLECIA, 83-000, PRUSZCZ GDAŃSKI,18.628278,54.260787, 76.83333333333333, 1007.7333333333332, 23.433333333333334,19.933333333333334,11.05, 2026-07-17 22:57:28
SZKOŁA PODSTAWOWA NR 3 IM. JANA MATEJKI W PRUSZCZU GDAŃSKIM, MATEJKI, 83-000, PRUSZCZ GDAŃSKI,18.636981,54.255547, 75.8, 1010.7666666666668, 25.400000000000002,12.533333333333331,7.803333333333334, 2026-07-17 22:57:28
SZKOŁA PODSTAWOWA NR 4 IM. IGNACEGO JANA PADEREWSKIEGO W PRUSZCZU GDAŃSKIM, KASPROWICZA, 83-000, PRUSZCZ GDAŃSKI,18.670231,54.263405, 73.89999999999999, 1010.3000000000001, 23.866666666666664,8.966666666666667,5.033333333333334, 2026-07-17 22:57:28
SZKOŁA PODSTAWOWA NR 13 W WIŚLE MAŁEJ, SOKOLA, 43-243, WISŁA MAŁA,18.793987,49.93368, 99.90000000000002, 990.0, 18.833333333333332,0.233333333333333,0.13, 2026-07-17 22:57:28
ZESPÓŁ SZKOLNO-PRZEDSZKOLNY W STUDZIENICACH, ŚW. JANA PAWŁA II 74, 43-215, STUDZIENICE,18.983576,50.016514, 90.96666666666665, 993.1999999999999, 24.0,1.666666666666666,0.946666666666666, 2026-07-17 22:57:28
SZKOŁA PODSTAWOWA IM. JANUSZA KORCZAKA W SUSZCU, SZKOLNA, 43-267, SUSZEC,18.79149,50.03719, 99.90000000000002, 998.3000000000001, 20.2,1.666666666666666,0.7933333333333331, 2026-07-17 22:57:28
SZKOŁA PODSTAWOWA NR 11 W PORĘBIE, SZKOLNA, 43-200, PORĘBA,18.876488,49.984417, 99.86666666666667, 998.3666666666668, 22.3,0.7000000000000001,0.376666666666666, 2026-07-17 22:57:28
SZKOŁA PODSTAWOWA IM. MIKOŁAJA KOPERNIKA W WYSOCKU MAŁYM, KOŚCIELNA, 63-421, WYSOCKO MAŁE,17.84109,51.61033, 99.90000000000002, 989.4666666666667, 19.933333333333334,11.866666666666667,5.943333333333332, 2026-07-17 22:57:28
SZKOŁA PODSTAWOWA NR 3 IM. JULIANA TUWIMA W NOWEJ SOLI, BOTANICZNA, 67-100, NOWA SÓL,15.71186,51.82115, 84.60000000000001, 1002.9333333333334, 25.166666666666668,4.3,2.34, 2026-07-17 22:57:28
ZESPÓŁ SZKÓŁ W JANKOWIE PIERWSZYM, JANKÓW PIERWSZY, 62-814, JANKÓW PIERWSZY,17.987951,51.902107, 99.90000000000002, 992.5, 20.2,9.766666666666666,5.693333333333334, 2026-07-17 22:57:28
ZESPÓŁ SZKOLNO-PRZEDSZKOLNY W MESZNIE, MESZNO, 48-385, MESZNO,17.15378,50.43684, 99.90000000000002, 980.0333333333333, 20.366666666666664,6.399999999999999,3.383333333333333, 2026-07-17 22:57:28
SZKOŁA PODSTAWOWA IM. 16. PUŁKU UŁANÓW WIELKOPOLSKICH W GRUPIE, SZKOLNA, 86-134, GRUPA,18.643229,53.506348, 76.63333333333334, 1005.4, 24.333333333333332,17.466666666666665,9.553333333333333, 2026-07-17 22:57:28
SZKOŁA PODSTAWOWA IM. ORŁA BIAŁEGO W KUROWICACH, SZKOLNA, 95-006, KUROWICE,19.6897942,51.6648927, 48.43333333333334, 985.3666666666667, 27.133333333333336,11.8,6.87, 2026-07-17 22:57:28
SZKOŁA PODSTAWOWA IM. POWSTAŃCÓW WIELKOPOLSKICH W BUDZYNIU, ROGOZIŃSKA, 64-840, BUDZYŃ,16.983885,52.8847, 65.26666666666667, 992.7666666666668, 24.366666666666664,14.0,8.503333333333332, 2026-07-17 22:57:28
SZKOŁA PODSTAWOWA W SWORNEGACIACH, SZKOLNA, 89-608, SWORNEGACIE,17.503073,53.86227, 74.33333333333333, 996.1333333333333, 23.900000000000002,5.7,2.953333333333333, 2026-07-17 22:57:28
SZKOŁA PODSTAWOWA IM. ORŁA BIAŁEGO W RASZÓWCE, 1 MAJA, 59-307, RASZÓWKA,16.18346,51.30514, 99.90000000000002, 992.8666666666667, 24.433333333333334,18.5,9.73, 2026-07-17 22:57:28
SZKOŁA PODSTAWOWA IM. TADEUSZA KOŚCIUSZKI W MUNINIE, 3-GO MAJA, 37-514, MUNINA,22.725977,49.997936, 56.5, 996.2999999999998, 6.8,68.4,42.61, 2026-07-17 22:57:28
SZKOŁA PODSTAWOWA IM. ALEKSANDRA FREDRY W SUROCHOWIE, SUROCHÓW, 37-500, SUROCHÓW,22.7635,50.02385, 71.83333333333333, 990.1, 23.233333333333334,17.433333333333334,10.29, 2026-07-17 22:57:28
SZKOŁA PODSTAWOWA IM. LOTNIKÓW ALIANCKICH W IŁOWEJ, PIASKOWA, 68-120, IŁOWA,15.20461,51.50227, 49.5, 993.7000000000002, 16.7,56.0,31.12, 2026-07-17 22:57:28
ZESPÓŁ SZKOLNO-PRZEDSZKOLNY W BOŻEJOWICACH, BOŻEJOWICE, 59-700, BOŻEJOWICE,15.541525,51.244331, 99.90000000000002, 988.3333333333334, 19.900000000000002,9.5,5.013333333333333, 2026-07-17 22:57:28
ZESPÓŁ SZKOLNO-PRZEDSZKOLNY W BRZEŹNIKU, BRZEŹNIK, 59-700, BRZEŹNIK,15.467881,51.243537, 77.9, 990.2000000000002, 24.899999999999995,0.799999999999999,0.456666666666666, 2026-07-17 22:57:28
SZKOŁA PODSTAWOWA W DĄBROWIE BOLESŁAWIECKIEJ, DĄBROWA BOLESŁAWIECKA, 59-700, DĄBROWA BOLESŁAWIECKA,15.57337,51.325929, 54.199999999999996, 995.1333333333333, 25.53333333333333,13.166666666666666,7.686666666666666, 2026-07-17 22:57:28
ZESPÓŁ SZKOLNO-PRZEDSZKOLNY W OCICACH, OCICE, 59-730, OCICE,15.492642,51.201123, 99.90000000000002, 992.3666666666667, 19.03333333333333,19.5,10.666666666666666, 2026-07-17 22:57:28
ZESPÓŁ SZKOLNO-PRZEDSZKOLNY W TRZEBIENIU, LEŚNA, 59-700, TRZEBIEŃ,15.599295,51.390285, 99.90000000000002, 980.8333333333334, 19.2,11.166666666666666,5.773333333333333, 2026-07-17 22:57:28
ZESPÓŁ SZKOLNO-PRZEDSZKOLNY W ŻELISZOWIE, ŻELISZÓW, 59-700, ŻELISZÓW,15.636493,51.188462, 99.90000000000002, 990.2333333333332, 20.066666666666666,14.133333333333333,8.413333333333332, 2026-07-17 22:57:28
SZKOŁA PODSTAWOWA IM. MARII SKŁODOWSKIEJ-CURIE W KAWĘCZYNIE, KAWĘCZYN, 62-704, KAWĘCZYN,18.53126,51.90873, 91.88, 1014.65, 8.93,28.28,16.42, 2026-07-17 22:57:28
PUBLICZNA SZKOŁA PODSTAWOWA IM. MARII KONOPNICKIEJ W JORDANOWIE ŚLĄSKIM, WROCŁAWSKA, 55-065, JORDANÓW ŚLĄSKI,16.8656,50.8654, 63.6, 997.5, 24.0,17.5,10.23, 2026-07-17 22:57:28
SZKOŁA PODSTAWOWA IM. JANA PAWŁA II W RUDNEJ, PIASKOWA, 59-305, RUDNA,16.26114,51.51127, 99.90000000000002, 994.1333333333333, 22.933333333333334,20.9,12.776666666666666, 2026-07-17 22:57:28
SZKOŁA PODSTAWOWA IM. BOHATERÓW WESTERPLATTE W CHOBIENI, SZKOLNA, 59-305, CHOBIENIA,16.44566,51.54124, 88.23333333333333, 996.5333333333333, 22.099999999999998,16.033333333333335,8.656666666666666, 2026-07-17 22:57:28
SZKOŁA PODSTAWOWA NR 3 IM. WŁADYSŁAWA BRONIEWSKIEGO W ŚWIEBODZICACH, ŚWIDNICKA, 58-160, ŚWIEBODZICE,16.322191,50.859905, 99.90000000000002, 978.5, 21.96666666666667,4.1,2.046666666666667, 2026-07-17 22:57:28
PUBLICZNA SZKOŁA PODSTAWOWA NR 5 IM. WŁADYSŁAWA BRONIEWSKIEGO W NOWEJ SOLI, WALKI MŁODYCH, 67-100, NOWA SÓL,15.72476,51.78292, 99.90000000000002, 1000.0666666666666, 24.133333333333336,6.6,3.806666666666666, 2026-07-17 22:57:28
ZESPÓŁ EDUKACYJNY W KOLSKU, PIASTOWSKA, 67-415, KOLSKO,15.961961,51.960693, 88.33999999999999, 1020.57, 9.94,37.83,22.350000000000005, 2026-07-17 22:57:28
SZKOŁA PODSTAWOWA NR 3 IM. MARII KONOPNICKIEJ W KOLE, TORUŃSKA, 62-600, KOŁO,18.63092,52.201656, 99.90000000000002, 997.4333333333334, 23.599999999999998,17.066666666666666,9.843333333333334, 2026-07-17 22:57:28
SZKOŁA PODSTAWOWA IM. JANA PAWŁA II W MIKORZYNIE, MIKORZYN, 63-600, MIKORZYN,18.026148,51.36473, 99.90000000000002, 986.6999999999999, 21.3,3.4666666666666672,1.863333333333333, 2026-07-17 22:57:28
SZKOŁA PODSTAWOWA NR 1 IM. BOHATERÓW WESTERPLATTE W KĘPNIE, HENRYKA SIENKIEWICZA, 63-600, KĘPNO,17.987194,51.27619, 90.10000000000001, 999.0, 26.099999999999998,4.6,2.56, 2026-07-17 22:57:28
SZKOŁA PODSTAWOWA IM. JANA PAWŁA II W LIPNICY WIELKIEJ, LIPNICA WIELKA, 33-323, LIPNICA WIELKA,20.86532,49.70755, 94.0, 985.0, 16.9,28.3,15.62, 2026-07-17 22:57:28
SZKOŁA PODSTAWOWA IM. PREZYDENTA GABRIELA NARUTOWICZA W CZĄSTKOWIE MAZOWIECKIM, CZĄSTKÓW MAZOWIECKI, 05-152, CZĄSTKÓW MAZOWIECKI,20.746943,52.39131, 53.666666666666664, 1000.4333333333334, 27.633333333333336,19.633333333333333,11.78, 2026-07-17 22:57:28
SZKOŁA PODSTAWOWA IM. PIERREA DE COUBERTINA W BUDACH SIENNICKICH, BUDY SIENNICKIE, 05-190, BUDY SIENNICKIE,20.787657,52.544962, 99.90000000000002, 990.5666666666666, 25.96666666666667,20.633333333333333,12.03, 2026-07-17 22:57:28
SZKOŁA PODSTAWOWA IM. JANA BRZECHWY W SZKLARACH GÓRNYCH, SZKLARY GÓRNE, 59-335, SZKLARY GÓRNE,16.08945,51.44225, 99.90000000000002, 995.9666666666666, 23.233333333333334,18.933333333333334,11.26, 2026-07-17 22:57:28
SAMORZĄDOWA SZKOŁA PODSTAWOWA W GÓRNYCH GRĄDACH, GÓRNE GRĄDY, 62-310, GÓRNE GRĄDY,17.74012,52.11447, 99.90000000000002, 1010.2800000000001, 20.5,2.799999999999999,1.5599999999999992, 2026-07-17 22:57:28
SZKOŁA PODSTAWOWA IM. KRZYSZTOFA KAMILA BACZYŃSKIEGO W CIĄŻENIU, WOLNOŚCI, 62-404, CIĄŻEŃ,17.816093,52.21152, 99.90000000000002, 1000.2000000000002, 23.8,8.3,4.28, 2026-07-17 22:57:28
SZKOŁA PODSTAWOWA NR 1 IM. STRAJKU DZIECI KOŹMIŃSKICH 1906/1907 W KOŹMINIE WIELKOPOLSKIM, GLINKI, 63-720, KOŹMIN WIELKOPOLSKI,17.45651,51.82566, 88.5, 1007.1, 13.300000000000002,19.5,11.76, 2026-07-17 22:57:28
SZKOŁA PODSTAWOWA SPORTOWA NR 6 W EŁKU, SUWALSKA, 19-300, EŁK,22.365547,53.82862, 84.39999999999999, 992.6666666666666, 21.666666666666668,21.23333333333333,13.076666666666668, 2026-07-17 22:57:28
SZKOŁA PODSTAWOWA NR 6 IM. JANA PAWŁA II W STAROGARDZIE GDAŃSKIM, BP. DOMINIKA, 83-250, STAROGARD GDAŃSKI,18.491356,53.98333, 83.0, 999.2666666666668, 23.53333333333333,6.099999999999999,3.606666666666667, 2026-07-17 22:57:28
PUBLICZNA SZKOLA PODSTAWOWA IM. BOHATEROW OŚWIĘCIMSKICH W RUDZICZCE, WOSZCZYCKA, 43-267, RUDZICZKA (SUSZEC),18.7549,50.03935, 46.633333333333326, 1004.7333333333332, 26.599999999999998,40.96666666666667,22.876666666666665, 2026-07-17 22:57:28
ZESPÓŁ SZKÓŁ TECHNICZNYCH W KOLE, KOLEJOWA, 62-600, KOŁO,18.62956,52.2088, 79.96666666666665, 995.7666666666668, 22.933333333333334,12.966666666666669,7.07, 2026-07-17 22:57:28
PUBLICZNA SZKOŁA PODSTAWOWA NR 2 IM. KAZIMIERZA PUŁASKIEGO W WARCE, POLNA, 05-660, WARKA,21.188357,51.78638, 45.13333333333333, 992.5666666666666, 26.733333333333334,15.233333333333333,8.466666666666667, 2026-07-17 22:57:28
SZKOŁA PODSTAWOWA NR 2 IM. STEFANA STARZYŃSKIEGO W NASIELSKU, KOŚCIUSZKI, 05-190, NASIELSK,20.801001,52.589717, 54.23333333333333, 990.0333333333333, 25.366666666666664,22.133333333333336,12.186666666666667, 2026-07-17 22:57:28
ZESPÓŁ SZKOLNO-PRZEDSZKOLNY W KAZUNIU NOWYM, GŁÓWNA, 05-152, KAZUŃ NOWY,20.68265,52.419853, 63.833333333333336, 1008.4333333333334, 24.099999999999998,16.5,9.563333333333334, 2026-07-17 22:57:28
SZKOŁA PODSTAWOWA IM. MIKOŁAJA KOPERNIKA W CIEKSYNIE, MARSZ. JÓZEFA PIŁSUDSKIEGO, 05-192, CIEKSYN,20.666605,52.572132, 93.0, 994.9, 25.066666666666666,23.633333333333336,14.74, 2026-07-17 22:57:28
SZKOŁA PODSTAWOWA NR 5 IM MIKOŁAJA KOPERNIKA W CZECHOWICACH-DZIEDZICACH, KLASZTORNA, 43-502, CZECHOWICE-DZIEDZICE,19.003326,49.908154, 46.13333333333333, 996.5, 26.166666666666668,16.5,8.71, 2026-07-17 22:57:28
SZKOŁA PODSTAWOWA IM. KS. JÓZEFA LONDZINA W ZABRZEGU, KAROLA PYTLA, 43-516, ZABRZEG,18.9401,49.91564, 96.60000000000001, 1012.8666666666667, 23.0,18.4,10.93, 2026-07-17 22:57:28
GMINNE PRZEDSZKOLE W NOWEJ WSI, UL. GŁÓWNA, 05-806, NOWA WIEŚ,20.793608032839607,52.14079879793492, 55.5, 1004.3333333333334, 26.099999999999998,14.5,8.11, 2026-07-17 22:57:28
SZKOŁA PODSTAWOWA IM. JANA PAWŁA II W MICHAŁOWICACH, UL. SZKOLNA, 05-816, MICHAŁOWICE,20.8894743996203,52.16806240949327, 54.03333333333333, 1002.6, 26.599999999999998,26.9,14.329999999999998, 2026-07-17 22:57:28
SZKOŁA PODSTAWOWA IM. MARII DĄBROWSKIEJ W KOMOROWIE, UL. M. DĄBROWSKIEJ, 05-806, KOMORÓW,20.814969926602924,52.14696671968943, 58.833333333333336, 1002.6999999999999, 26.733333333333334,6.399999999999999,3.869999999999999, 2026-07-17 22:57:28
SZKOŁA PODSTAWOWA IM. MIKOŁAJA KOPERNIKA W NOWEJ WSI, UL. GŁÓWNA, 05-806, NOWA WIEŚ,20.80065871311049,52.134787344746286, 55.5, 1004.3333333333334, 26.099999999999998,14.5,8.11, 2026-07-17 22:57:28
GMINNE PRZEDSZKOLE W MICHAŁOWICACH, UL. SZKOLNA, 05-816, MICHAŁOWICE,20.8908240883606,52.16924425690457, 54.03333333333333, 1002.6, 26.599999999999998,26.9,14.329999999999998, 2026-07-17 22:57:28
ZESPÓŁ SZKOLNO-PRZEDSZKOLNY W SMOŁDZINIE, BOHATERÓW WARSZAWY, 76-214, SMOŁDZINO,17.217509899999996,54.66198055959346, 99.90000000000002, 1009.2333333333332, 19.766666666666666,11.466666666666669,7.006666666666667, 2026-07-17 22:57:28
ZESPÓŁ SZKOLNO- PRZEDSZKOLNY W0DOBRZYKOWICACH, UL. SUKCESU, 55-002, DOBRZYKOWICE,17.185415,51.092059, 99.90000000000002, 987.4666666666667, 20.733333333333334,13.366666666666667,7.55, 2026-07-17 22:57:28
SZKOŁA PODSTAWOWA IM. PIASTÓW ŚLĄSKICH W CHRZĄSTAWIE WIELKIEJ, UL. WROCŁAWSKA, 55-003, CZERNICA,17.292154,51.092542, 71.2, 979.9, 31.0,32.86666666666667,17.62, 2026-07-17 22:57:28
ZESPÓŁ SZKOLNO-PRZEDSZKOLNY IM. PAPIEŻA JANA PAWŁA II W CZERNICY, UL. ŚW. BRATA ALBERTA ADAMA CHMIELOWSKIEGO0, 55-003, CZERNICA,17.248533,51.0473805, 73.26666666666667, 1000.1, 22.733333333333334,15.5,9.726666666666668, 2026-07-17 22:57:28
SZKOŁA PODSTAWOWA IM. JANUSZA KORCZAKA W RATOWICACH, UL. WROCŁAWSKA, 55-003, CZERNICA,17.26685,51.033897, 99.90000000000002, 982.3333333333334, 20.933333333333334,14.533333333333331,7.963333333333334, 2026-07-17 22:57:28
SZKOŁA PODSTAWOWA IM. BOLESŁAW KRZYWOUSTEGO W KAMIEŃCU WROCŁAWSKIM, UL. KOLEJOWA, 55-002, KAMIENIEC WROCŁAWSKI,17.173628,51.077638, 99.90000000000002, 985.1999999999999, 21.666666666666668,13.166666666666666,7.736666666666667, 2026-07-17 22:57:28
SZKOŁA PODSTAWOWA NR 4 IM. JANA MEJSTERA W SŁOMCZYNIE, WILANOWSKA, 05-520, KONSTANCIN-JEZIORNA,21.15329336951058,52.060898677662806, 62.4, 991.3333333333334, 24.133333333333336,20.466666666666665,12.443333333333332, 2026-07-17 22:57:28
PUBLICZNA SZKOŁA PODSTAWOWA W TOMASZOWIE, LEŚNA, 68-114, TOMASZÓW,15.404658513741197,51.622513710796575, 58.833333333333336, 987.6, 23.5,6.666666666666667,3.633333333333333, 2026-07-17 22:57:28
SZKOŁA PODSTAWOWA NR 29 W LUBLINIE, WAJDELOTY, 20-604, LUBLIN,22.5237824136724,51.2433286093504, 39.0, 998.0, 24.2,3.0,2.0, 2026-07-17 22:57:28
SZKOŁA PODSTAWOWA W SZKODNEJ, , 39-126, SZKODNA,21.6475593266686,49.9841839576423, 70.31666666666666, 974.1999999999999, 24.491666666666664,15.85,15.825, 2026-07-17 22:57:28
SZKOŁA PODSTAWOWA IM. MARII KONOPNICKIEJ W MŁODOWIE, UL. SZKOLNA, 37-600, MŁODÓW,23.1625474248211,50.1612772043517, 40.56666666666667, 986.0, 27.525000000000002,11.333333333333334,9.583333333333334, 2026-07-17 22:57:28
SZKOŁA PODSTAWOWA NR 3 IM. JANA PAWŁA II W ROPCZYCACH, 3 MAJA, 39-100, ROPCZYCE,21.5832672438671,50.0389694490123, 57.583333333333336, 985.0, 24.150000000000002,16.416666666666668,13.166666666666666, 2026-07-17 22:57:28
SZKOŁA PODSTAWOWA NR 2 IM. BŁ. JANA PAWŁA II W LIBIĄŻU, PLAC ZWYCIĘSTWA, 32-590, LIBIĄŻ,19.3064540609702,50.0995764389139, 66.31666666666666, 978.8333333333334, 23.166666666666668,6.5,5.5, 2026-07-17 22:57:28
SZKOŁA PODSTAWOWA NR 2  IM. KAZIMIERZA BRODZIŃSKIEGO W BOCHNI, ORACKA, 32-700, BOCHNIA,20.4250867479996,49.9702658831946, 51.775, 983.0, 27.55,11.333333333333334,9.916666666666666, 2026-07-17 22:57:28
