SZKOŁA PODSTAWOWA NR 20 IM. STEFANA BATOREGO W POZNANIU, OS. RZECZYPOSPOLITEJ, 61-395, POZNAŃ,16.951088,52.387907, 78.22461538461538, 1001.4176923076923, 22.143076923076926,20.346153846153847,8.076923076923077, 2026-07-17 22:57:28
SZKOŁA PODSTAWOWA NR 87 W POZNANIU, UL. LESZKA, 61-062, POZNAŃ,17.01931,52.40721, 91.54916666666666, 999.6775000000001, 21.6375,17.75,9.416666666666666, 2026-07-17 22:57:28
SZKOŁA PODSTAWOWA NR 91 W POZNANIU, PROMYK, 60-393, POZNAŃ,16.870474,52.409934, 74.19076923076923, 999.1615384615385, 22.842307692307692,8.538461538461538,8.153846153846153, 2026-07-17 22:57:28
SZKOŁA PODSTAWOWA NR 72 IM. MIKOŁAJA KOPERNIKA W POZNANIU, UL. NEWTONA, 60-161, POZNAŃ,16.867393,52.383159, 94.4532, 998.6360000000001, 23.270799999999998,27.56,10.04, 2026-07-17 22:57:28
SZKOŁA PODSTAWOWA IM. GEN. STEFANA ROWECKIEGO „GROTA” W KOZIEGŁOWACH, UL. POZNAŃSKA, 62-028, KOZIEGŁOWY,16.990947,52.445023, 100.0, 998.7844, 22.3196,15.52,15.04, 2026-07-17 22:57:28
SZKOŁA PODSTAWOWA NR 2 IM. TEOFILI Z DZIAŁYŃSKICH SZOŁDRSKIEJ-POTULICKIEJ W KÓRNIKU, UL. ARMII KRAJOWEJ, 62-035, KÓRNIK,17.0953,52.23251, 100.0, 1000.5975999999999, 22.4212,22.32,14.2, 2026-07-17 22:57:28
SZKOŁA PODSTAWOWA NR 1 IM. JANA PAWŁA II W TARNOWIE PODGÓRNYM, UL. SZKOLNA, 62-080, TARNOWO PODGÓRNE,16.662828,52.467372, 100.0, 996.87, 22.158235294117645,9.588235294117649,9.411764705882351, 2026-07-17 22:57:28
SZKOŁA PODSTAWOWA NR 2 IM. KS. PIOTRA WAWRZYNIAKA W ŚREMIE, UL. SZKOLNA, 63-100, ŚREM,17.02436,52.09399, 82.83, 1000.3276, 22.326,13.8,11.0, 2026-07-17 22:57:28
SZKOŁA PODSTAWOWA IM. ARKADEGO FIEDLERA W PRZYBOROWIE, UL. BAJKOWA, 64-500, PRZYBOROWO,16.57542,52.55638, 100.0, 999.49, 23.228,16.52,13.0, 2026-07-17 22:57:28
SZKOŁA PODSTAWOWA NR 1 IM. STANISŁAWA STASZICA W SZAMOTUŁACH, UL. STASZICA, 64-500, SZAMOTUŁY,16.586295,52.607202, 100.0, 999.9124, 22.6396,11.88,11.48, 2026-07-17 22:57:28
SZKOŁA PODSTAWOWA NR 2 IM. MARII KONOPNICKIEJ W SZAMOTUŁACH, UL. KAPŁAŃSKA, 64-500, SZAMOTUŁY,16.577349,52.611083, 91.52040000000001, 1000.326, 22.788800000000002,11.12,10.68, 2026-07-17 22:57:28
SZKOŁA PODSTAWOWA IM. BOHATERÓW BUKOWSKICH W BUKU, UL. SZKOLNA, 64-320, BUK,16.522668,52.35663, 100.0, 997.5665384615385, 23.05807692307692,15.346153846153848,12.23076923076923, 2026-07-17 22:57:28
PRZEDSZKOLE BAJECZKA W ROKIETNICY, UL. NOBLISTÓW, 62-090, ROKIETNICA,16.738427,52.510745, 78.22461538461538, 1001.4176923076923, 22.143076923076926,20.346153846153847,8.076923076923077, 2026-07-17 22:57:28
PRZEDSZKOLE ZACZAROWANA ŁĄKA W MROWINIE, ul. Szkolna, 62-090, MROWINO,16.69876,52.51423, 100.0, 999.1004347826088, 22.675217391304347,17.217391304347824,13.73913043478261, 2026-07-17 22:57:28
SZKOŁA PODSTAWOWA IM. POWSTAŃCÓW WIELKOPOLSKICH W KISZEWIE, , 64-607, KISZEWO,16.67316,52.68016, 100.0, 1002.2447999999999, 22.308000000000003,11.72,9.48, 2026-07-17 22:57:28
SZKOŁA PODSTAWOWA IM. ASTRID LINDGREN W DĄBROWIE, UL. SZKOLNA, 62-069, DĄBROWA,16.73993,52.403575, 78.22461538461538, 1001.4176923076923, 22.143076923076926,20.346153846153847,8.076923076923077, 2026-07-17 22:57:28
SZKOŁA PODSTAWOWA IM. JANUSZA KORCZAKA W CERADZU KOŚCIELNYM, UL. JANKOWICKA, 62-080, CERADZ KOŚCIELNY,16.592828,52.438889, 100.0, 997.5032000000001, 22.3208,18.08,11.96, 2026-07-17 22:57:28
SZKOŁA PODSTAWOWA NR 2 W MOSINIE, UL. SOWINIECKA, 62-050, MOSINA,16.85712,52.24318, 97.7475, 1000.713125, 21.475625,12.35,9.7, 2026-07-17 22:57:28
SZKOŁA PODSTAWOWA IM. HRABIEGO WŁADYSŁAWA ZAMOYSKIEGO W NOCHOWIE, UL. SZKOLNA, 63-100, NOCHOWO,16.978622359922714,52.07206190376306, 100.0, 998.6456, 21.4536,12.72,10.48, 2026-07-17 22:57:28
SZKOŁA PODSTAWOWA IM. AUGUSTA CIESZKOWSKIEGO W KICINIE, UL. GWARNA, 62-004, KICIN,17.02037,52.46266, 79.5576923076923, 998.4661538461538, 21.86423076923077,10.923076923076923,8.807692307692308, 2026-07-17 22:57:28
SZKOŁA PODSTAWOWA NR 1 IM. JANUSZA KORCZAKA W KOMORNIKACH, STASZICA, 62-052, KOMORNIKI,16.8105,52.33881, 78.22461538461538, 1001.4176923076923, 22.143076923076926,20.346153846153847,8.076923076923077, 2026-07-17 22:57:28
SZKOŁA PODSTAWOWA NR 2 IM. RADY EUROPY W KOSTRZYNIE, UL. POWSTAŃCÓW WIELKOPOLSKICH, 62-025, KOSTRZYN,17.23588,52.39434, 100.0, 997.371923076923, 20.833846153846153,13.923076923076923,11.115384615384617, 2026-07-17 22:57:28
SZKOŁA PODSTAWOWA NR 2 W PLEWISKACH, PROF. WACŁAWA STRAŻEWICZA, 62-064, PLEWISKA,16.807346,52.372825, 78.22461538461538, 1001.4176923076923, 22.143076923076926,20.346153846153847,8.076923076923077, 2026-07-17 22:57:28
SZKOŁA PODSTAWOWA W BISKUPICACH, UL. SZKOLNA, 62-007, BISKUPICE,17.17261,52.46002, 1.0, 997.43, 21.0244,26.28,10.68, 2026-07-17 22:57:28
ZESPÓŁ SZKOLNO-PRZEDSZKOLNY W MODRZU, UL. KOŚCIUSZKI, 62-060, MODRZE,16.6324,52.21468, 100.0, 1000.2246153846154, 22.678846153846152,11.538461538461538,9.538461538461538, 2026-07-17 22:57:28
SZKOŁA PODSTAWOWA NR 5 IM. JANUSZA KORCZAKA, ul. Chramcówki, 34-500, ZAKOPANE,19.9618010711644,49.30218537164973, 69.3, 979.75, 21.78333333333333,20.091666666666665,19.841666666666665, 2026-07-17 22:57:28
TECHNIKUM NR 2 W WAŁBRZYCHU, UL. OGRODOWA, 58-306, WAŁBRZYCH,16.2843553,50.7840092, 81.64545454545454, 963.9545454545455, 22.018181818181816,6.445454545454544,6.445454545454544, 2026-07-17 22:57:28
ZESPÓŁ SZKOLNO - PRZEDSZKOLNY W STRYKOWIE - PRZEDSZKOLE W STRYKOWIE, ul. Bukowska, 62-060, STĘSZEW,16.615,52.2472, 100.0, 998.8548, 22.2304,14.16,11.28, 2026-07-17 22:57:28
I LICEUM OGÓLNOKSZTAŁCĄCE IM. TADEUSZA KOŚCIUSZKI W LEGNICY, PL. KLASZTORNY, 59-220, LEGNICA,16.16627117,51.21034014, 66.99166666666666, 996.5416666666666, 26.425,7.75,7.35, 2026-07-17 22:57:28
SZKOŁA PODSTAWOWA NR 7 IM. KORNELA MAKUSZYŃSKIEGO W SKIERNIEWICACH, UL. ŚW. MAKSYMILIANA KOLBE, 96-100, SKIERNIEWICE,20.21964301,51.9792264, 46.75454545454545, 993.8727272727273, 28.772727272727273,11.28181818181818,9.481818181818182, 2026-07-17 22:57:28
SZKOŁA PODSTAWOWA IM. FRANCISZKA KUJAWIŃSKIEGO W GÓRKACH DUŻYCH, UL. JUTROSZEWSKA, 95-080, GÓRKI DUŻE,19.50526554,51.56553408, 54.89166666666667, 980.4833333333332, 26.425,9.558333333333334,9.3, 2026-07-17 22:57:28
ZESPÓŁ SZKÓŁ CENTRUM KSZTAŁCENIA ROLNICZEGO IM. MICHAŁA DRZYMAŁY W BRZOSTOWIE, ul. Popiela, 89-350, BRZOSTOWO,17.02117714,53.10320061, 73.33333333333333, 994.2222222222222, 23.644444444444446,10.511111111111113,10.511111111111113, 2026-07-17 22:57:28
SZKOŁA PODSTAWOWA W RUDNIKACH IM. POWSTAŃCÓW STYCZNIOWYCH, , 42-230, RUDNIKI,19.79088652,50.82569402, 68.75833333333334, 983.525, 25.166666666666668,12.7,12.233333333333334, 2026-07-17 22:57:28
SZKOŁA PODSTAWOWA NR 2 IM. JANA PAWŁA II W PRZECISZOWIE, UL. PODLESIE, 32-641, PRZECISZÓW,19.3738442,50.0088626, 70.4, 983.1999999999999, 25.75,5.766666666666668,4.716666666666667, 2026-07-17 22:57:28
SZKOŁA PODSTAWOWA NR 5 W PYSKOWICACH, UL. SZKOLNA, 44-120, PYSKOWICE,18.627695,50.391498, 93.25833333333333, 983.8166666666666, 20.7,6.333333333333333,5.241666666666666, 2026-07-17 22:57:28
ZESPÓŁ PLACÓWEK OŚWIATOWYCH IM. PROF. KAROLINY LANCKOROŃSKIEJ W JASIENICY, , 32-400, JASIENICA,19.84190401,49.82371084, 62.36666666666667, 966.2916666666666, 24.95,10.583333333333334,9.416666666666666, 2026-07-17 22:57:28
SZKOŁA PODSTAWOWA SPECJALNA NR 10 IM. JANUSZA KORCZAKA W ŚWIĘTOCHŁOWICACH, UL. ŁAGIEWNICKA, 41-608, ŚWIĘTOCHŁOWICE,18.91285,50.310584, 87.72500000000001, 973.1666666666666, 20.625,0.274999999999999,0.216666666666666, 2026-07-17 22:57:28
SZKOŁA PODSTAWOWA IM. KAPITAN AK JADWIGI BEAUPRE W SYGNECZOWIE, , 32-020, SYGNECZÓW,20.01655459,49.97577128, 61.64545454545455, 967.3454545454545, 26.172727272727272,12.563636363636364,10.981818181818182, 2026-07-17 22:57:28
PUBLICZNA SZKOŁA PODSTAWOWA  IM. KORNELA MAKUSZYŃSKIEGO WE WRZESZCZOWIE, , 26-650, WRZESZCZÓW,20.827514,51.4984472, 65.49166666666666, 990.6083333333335, 25.46666666666667,17.45,17.825, 2026-07-17 22:57:28
SZKOŁA PODSTAWOWA NR 42 IM. KONSTANTEGO ILDEFONSA GAŁCZYŃSKIEGO W LUBLINIE, UL. RYCERSKA, 20-552, LUBLIN,22.51737314,51.28129644, 38.541666666666664, 982.9250000000001, 27.433333333333334,7.916666666666667,7.658333333333334, 2026-07-17 22:57:28
SPECJALNY OŚRODEK SZKOLNO-WYCHOWAWCZY IM. JANUSZA KORCZAKA W WĄSOSZU SZKOŁA PODSTAWOWA SPECJALNA W WĄSOSZU, UL. KORCZAKA, 56-210, WĄSOSZ,16.6888619,51.5612083, 86.7, 999.0500000000001, 22.058333333333334,13.766666666666666,11.775, 2026-07-17 22:57:28
SZKOŁA PODSTAWOWA W JANUSZOWEJ, , 33-300, JANUSZOWA,20.7262059,49.6480989, 59.30833333333334, 964.8166666666666, 24.733333333333334,16.183333333333334,17.183333333333334, 2026-07-17 22:57:28
V LICEUM OGÓLNOKSZTAŁCĄCE IM. MARII SKŁODOWSKIEJ-CURIE W LUBLINIE, UL. LIPOWA, 20-020, LUBLIN,22.5515879,51.2462049, 41.55833333333333, 987.5749999999999, 27.916666666666668,12.041666666666666,11.033333333333331, 2026-07-17 22:57:28
XXXII LICEUM OGÓLNOKSZTAŁCĄCE IM. HALINY POŚWIATOWSKIEJ W ZESPOLE SZKÓŁ OGÓLNOKSZTAŁCĄCYCH NR 1 W ŁODZI, UL. PIOTRA CZAJKOWSKIEGO, 92-511, ŁÓDŹ-WIDZEW,19.54161351,51.75532332, 53.525, 980.85, 27.25,10.741666666666667,9.0, 2026-07-17 22:57:28
ZESPÓŁ SZKÓŁ IM.T.KOŚCIUSZKI TECHNIKUM W ŻARKACH, UL. MYSZKOWSKA, 42-310, ŻARKI,19.361968,50.6212895, 78.18888888888888, 973.1999999999999, 21.544444444444444,4.588888888888889,4.166666666666667, 2026-07-17 22:57:28
SZKOŁA PODSTAWOWA NR 14 IM. KARPACKIEGO ODDZIAŁU STRAŻY GRANICZNEJ W NOWYM SĄCZU, UL. TOWAROWA, 33-300, NOWY SĄCZ,20.66566532,49.57927032, 71.58333333333333, 975.7916666666666, 26.108333333333334,13.35,10.75, 2026-07-17 22:57:28
SZKOŁA PODSTAWOWA IM. JANA PAWŁA II W BAŻYNACH, , 11-130, BAŻYNY,20.04206066,54.13202111, 72.3, 1003.5416666666666, 23.675,15.675,14.725, 2026-07-17 22:57:28
SZKOŁA PODSTAWOWA NR 6 IM. JÓZEFA RAJSKIEGO BURMISTRZA NOWEGO TARGU W NOWYM TARGU, OS. NA SKARPIE, 34-400, NOWY TARG,20.0048339,49.4720351, 61.64166666666667, 940.8916666666665, 24.941666666666666,15.275,13.516666666666666, 2026-07-17 22:57:28
SZKOŁA PODSTAWOWA IM. WŁ.ST. REYMONTA W RĘBIELICACH KRÓLEWSKICH, UL. SZKOLNA, 42-110, RĘBIELICE KRÓLEWSKIE,18.8604488,50.9958114, 90.3, 987.5818181818181, 19.945454545454545,9.872727272727271,9.5, 2026-07-17 22:57:28
SZKOŁA PODSTAWOWA 8 IM. JANA PAWŁA II W TRZEBINI, os. OSIEDLE WIDOKOWE, 32-540, TRZEBINIA,19.47774417,50.16051239, 63.68333333333334, 968.0, 25.325,8.291666666666666,7.041666666666667, 2026-07-17 22:57:28
ZESPÓŁ SZKOLNO-PRZEDSZKOLNY NR 21 W KRAKOWIE, ul. Golikówka, 30-723, KRAKÓW,20.03407325,50.04592292, 67.34166666666667, 984.0416666666666, 26.691666666666666,14.25,11.683333333333332, 2026-07-17 22:57:28
SZKOŁA PODSTAWOWA NR 3 IM.KSIĘDZA PUŁKOWNIKA JÓZEFA JOŃCA W LIMANOWEJ, UL. STANISŁAWA JORDANA, 34-600, LIMANOWA,20.41776042,49.70246023, 70.09166666666667, 963.6166666666667, 24.224999999999998,14.008333333333333,12.175, 2026-07-17 22:57:28
SZKOŁA PODSTAWOWA IM. ŚW. JANA PAWŁA II W CIĘŻKOWICACH, UL. TYSIĄCLECIA, 33-190, CIĘŻKOWICE,20.97328669,49.78379261, 64.3, 974.9, 25.825,17.433333333333334,15.316666666666668, 2026-07-17 22:57:28
SZKOŁA PODSTAWOWA NR 1 IM. BOHATERÓW WESTERPLATTE W STAREJ WSI., , 34-600, STARA WIEŚ,20.39643761,49.67579946, 66.18333333333334, 953.2666666666668, 23.708333333333332,11.708333333333334,10.083333333333334, 2026-07-17 22:57:28
SZKOŁA PODSTAWOWA IM. FRANCISZKA ŚWIEBOCKIEGO W BARCICACH, , 33-342, BARCICE,20.652878,49.5256828, 61.96666666666667, 970.625, 25.858333333333334,15.083333333333334,13.391666666666666, 2026-07-17 22:57:28
SZKOŁA PODSTAWOWA IM. LEOPOLDA WĘGRZYNOWICZA W DOBREJ, , 34-642, DOBRA,20.24427874,49.71571898, 65.36363636363636, 954.8545454545455, 24.10909090909091,9.672727272727274,9.672727272727274, 2026-07-17 22:57:28
SZKOŁA PODSTAWOWA IM. ŚW. JANA KANTEGO W ŁAPANOWIE, , 32-740, ŁAPANÓW,20.28812671,49.86672284, 75.45, 980.6333333333333, 24.483333333333334,9.375,8.716666666666667, 2026-07-17 22:57:28
SZKOŁA PODSTAWOWA IM. KS. KARD. STEFANA WYSZYŃSKIEGO W KADCZY, , 33-389, KADCZA,20.54374173,49.53487392, 72.55, 970.0083333333333, 23.875,12.75,11.516666666666666, 2026-07-17 22:57:28
PUBLICZNA SZKOŁA PODSTAWOWA IM. KAZIMIERZA BRODZIŃSKIEGO W LIPNICY MUROWANEJ, , 32-724, LIPNICA MUROWANA,20.52481697,49.85975952, 75.68333333333334, 975.0916666666667, 24.491666666666664,15.158333333333331,14.883333333333333, 2026-07-17 22:57:28
ZESPÓŁ SZKÓŁ W BRUNARACH, Brunary, 38-315, UŚCIE GORLICKIE,21.03494141,49.53210004, 75.29166666666667, 960.2916666666666, 22.208333333333332,13.208333333333334,10.991666666666667, 2026-07-17 22:57:28
SZKOŁA PODSTAWOWA NR 2 IM. ŚWIĘTEJ JADWIGI KRÓLOWEJ POLSKI, UL. MIŁOŚNIKÓW PODHALA, 34-425, BIAŁY DUNAJEC,20.00539035,49.35921481, 72.175, 991.025, 21.84166666666667,15.35,15.083333333333334, 2026-07-17 22:57:28
SZKOŁA PODSTAWOWA IM. ST. LESZCZYC-PRZYWARY W KĄCLOWEJ, , 33-330, KĄCLOWA,20.96481091,49.58920601, 69.075, 967.1583333333333, 24.95,15.541666666666666,13.525, 2026-07-17 22:57:28
SZKOŁA PODSTAWOWA IM. OJCA ŚWIĘTEGO JANA PAWŁA II W ŁĘGU TARNOWSKIM, UL. WITOSA, 33-131, ŁĘG TARNOWSKI,20.92801249,50.09203019, 53.975, 997.1999999999999, 10.0,15.025,15.616666666666667, 2026-07-17 22:57:28
SZKOŁA PODSTAWOWA W KŁAJU, , 32-015, KŁAJ,20.30859627,49.99014026, 61.550000000000004, 984.7833333333333, 27.258333333333336,16.308333333333334,16.05, 2026-07-17 22:57:28
SZKOŁA PODSTAWOWA IM. ŚWIĘTEGO JANA PAWŁA II W LUBNIU, , 32-433, LUBIEŃ,19.97797646,49.71552326, 70.26666666666667, 967.025, 24.09166666666667,15.683333333333332,14.158333333333331, 2026-07-17 22:57:28
SZKOŁA PODSTAWOWA W JAWORZNEJ, , 34-602, JAWORZNA,20.49293011,49.74829091, 62.56666666666666, 961.5916666666667, 24.583333333333332,8.866666666666667,7.225, 2026-07-17 22:57:28
SZKOŁA PODSTAWOWA IM. ŚW. JANA KANTEGO W LUDŹMIERZU, ul. Kazimierza Przerwy-Tetmajera, 34-471, LUDŹMIERZ,19.969404,49.47236233, 43.333333333333336, 996.7999999999998, 29.0,13.066666666666668,12.8, 2026-07-17 22:57:28
SZKOŁA PODSTAWOWA IM. ŚW. KAZIMIERZA JAGIELLOŃCZYKA W BAŃSKIEJ NIŻNEJ, UL. PAPIESKA, 34-424, BAŃSKA NIŻNA,20.01057106,49.40405611, 64.30833333333334, 990.6166666666667, 23.041666666666668,10.741666666666667,9.416666666666666, 2026-07-17 22:57:28
SZKOŁA PODSTAWOWA IM. KORNELA MAKUSZYŃSKIEGO W ŁADNEJ, , 33-156, ŁADNA,21.094243,50.013466, 60.425000000000004, 979.4083333333333, 25.400000000000002,11.35,9.858333333333333, 2026-07-17 22:57:28
SZKOŁA PODSTAWOWA IM. HENRYKA SIENKIEWICZA W ZRĘCZYCACH, ZRĘCZYCE, 32-420, ZRĘCZYCE,20.22211,49.89188, 53.574999999999996, 976.2333333333332, 27.791666666666668,10.6,9.608333333333333, 2026-07-17 22:57:28
SZKOŁA PODSTAWOWA NR 2 IM. BOHATERÓW WESTERPLATTE W MYŚLENICACH, UL. STEFANA ŻEROMSKIEGO, 32-400, MYŚLENICE,19.94495616,49.83418288, 54.35833333333333, 973.8833333333333, 27.46666666666667,9.658333333333331,8.325000000000001, 2026-07-17 22:57:28
SZKOŁA PODSTAWOWA NR 11 IM. ŻOŁNIERZY ARMII KRAJOWEJ W NOWYM TARGU, PL. EVRY, 34-400, NOWY TARG,20.03357858,49.47217767, 66.325, 941.6416666666668, 24.425,8.625,7.558333333333334, 2026-07-17 22:57:28
SZKOŁA PODSTAWOWA NR 2 IMIENIA MARII KONOPNICKIEJ W ANDRYCHOWIE, UL. IGNACEGO DASZYŃSKIEGO, 34-120, ANDRYCHÓW,19.34475154,49.84947622, 71.7, 970.9499999999999, 22.766666666666666,4.524999999999999,3.875, 2026-07-17 22:57:28
SZKOŁA PODSTAWOWA IM. WINCENTEGO WITOSA W RUDCE, , 33-122, RUDKA,20.8875344,50.04900702, 57.31666666666666, 985.5416666666666, 26.816666666666666,24.383333333333336,20.64166666666667, 2026-07-17 22:57:28
SZKOŁA PODSTAWOWA IM.TADEUSZA KOŚCIUSZKI W KONIUSZY, , 32-104, KONIUSZA,20.21421526,50.18825826, 60.275, 973.2916666666666, 27.166666666666668,18.675,18.03333333333333, 2026-07-17 22:57:28
SZKOŁA PODSTAWOWA NR 3 IM. KOMISJI EDUKACJI NARODOWEJ 32-050 SKAWINA UL. ADAMA MICKIEWICZA 11 A, UL. ADAMA MICKIEWICZA, 32-050, SKAWINA,19.82265223,49.97521231, 70.2, 984.1416666666668, 25.275000000000002,8.708333333333334,7.091666666666666, 2026-07-17 22:57:28
SZKOŁA PODSTAWOWA W ZESPOLE SZKÓŁ OGÓLNOKSZTAŁCĄCYCH IM. KAZIMIERZA WIELKIEGO W SŁOMNIKACH, UL. ŚW. JANA PAWŁA II, 32-090, SŁOMNIKI,20.0858955,50.24468645, 64.075, 976.7833333333333, 26.325,16.083333333333332,13.166666666666666, 2026-07-17 22:57:28
SZKOŁA PODSTAWOWA NR 1 IM. HENRYKA SIENKIEWICZA, UL. HENRYKA SIENKIEWICZA, 34-730, MSZANA DOLNA,20.06982247,49.67621722, 67.54166666666667, 962.3499999999999, 24.275000000000002,14.466666666666669,13.425, 2026-07-17 22:57:28
SZKOŁA PODSTAWOWA NR 2 IM. WŁADYSŁAWA ORKANA W RABCE-ZDROJU, UL. SĄDECKA, 34-700, RABKA-ZDRÓJ,19.94603163,49.61151453, 72.28333333333333, 954.2999999999998, 23.258333333333336,16.441666666666666,14.9, 2026-07-17 22:57:28
SZKOŁA PODSTAWOWA IM. JANA PAWŁA II W GOŁCZY, , 32-075, GOŁCZA,19.92773436,50.3372467, 67.88333333333334, 972.75, 25.183333333333334,15.125,13.316666666666668, 2026-07-17 22:57:28
SZKOŁA PODSTAWOWA IM. KPT. PIL. MIECZYSŁAWA MEDWECKIEGO, , 32-084, MORAWICA,19.75549535,50.08126882, 80.5, 1009.7333333333332, 22.5,29.691666666666663,28.65833333333333, 2026-07-17 22:57:28
SZKOŁA PODSTAWOWA NR 1 W KOZŁOWIE, , 32-241, KOZŁÓW,20.02161231,50.48113008, 63.75, 972.6, 24.816666666666666,16.133333333333333,13.583333333333334, 2026-07-17 22:57:28
SZKOŁA PODSTAWOWA IM. KRÓLA KAZIMIERZA III WIELKIEGO W RUDNIKU, UL. SZKOLNA, 32-440, RUDNIK,19.83265837,49.85476119, 58.88333333333333, 970.1416666666668, 26.21666666666667,9.116666666666667,8.1, 2026-07-17 22:57:28
PUBLICZNA SZKOŁA PODSTAWOWA W WOJAKOWEJ, , 32-862, WOJAKOWA,20.56161481,49.8026459, 80.075, 975.8416666666667, 22.683333333333334,12.158333333333331,11.891666666666666, 2026-07-17 22:57:28
SZKOŁA PODSTAWOWA NR 1 IM.MARII KONOPNICKIEJ W PRZYSZOWEJ, , 34-604, PRZYSZOWA,20.50552913,49.63812628, 69.14166666666667, 959.4916666666667, 24.375,10.491666666666667,9.566666666666666, 2026-07-17 22:57:28
SZKOŁA PODSTAWOWA IM. TADEUSZA KOŚCIUSZKI W STRONIU, , 34-145, STRONIE,19.67411334,49.83221959, 59.583333333333336, 962.5333333333333, 24.775000000000002,7.916666666666667,6.5, 2026-07-17 22:57:28
SZKOŁA PODSTAWOWA IM. WŁADYSŁAWA ORKANA W MANIOWACH, UL. SZKOLNA, 34-436, MANIOWY,20.26889513,49.46175645, 66.69166666666666, 950.9166666666666, 22.925,12.658333333333331,11.191666666666668, 2026-07-17 22:57:28
SZKOŁA PODSTAWOWA NR 3 IM. ADAMA MICKIEWICZA W STRÓŻY, , 32-431, STRÓŻA,19.94669482,49.78446923, 73.21666666666667, 972.4333333333334, 23.59166666666667,11.375,10.45, 2026-07-17 22:57:28
SZKOŁA PODSTAWOWA NR 1 IM. KARPACKIEGO ODDZIAŁU STRAŻY GRANICZNEJ, , 38-312, ROPA,21.04369192,49.60148893, 71.65833333333333, 969.7166666666667, 24.28333333333333,11.758333333333333,9.833333333333334, 2026-07-17 22:57:28
ZESPÓŁ SZKOLNO-PRZEDSZKOLNY IM.MAJORA HENRYKA SUCHARSKIEGO W SPYTKOWICACH, ul. Szkolna, 34-116, SPYTKOWICE,19.50690621,49.99665238, 76.91666666666667, 983.7083333333334, 23.5,12.35,11.816666666666668, 2026-07-17 22:57:28
SZKOŁA PODSTAWOWA W CZUBROWICACH, , 32-049, CZUBROWICE,19.6875125,50.21345386, 72.47272727272728, 963.7545454545453, 23.854545454545452,15.854545454545455,13.57272727272727, 2026-07-17 22:57:28
SZKOŁA PODSTAWOWA IM. BRONISŁAWA WANATA W MOSZCZENICY, UL. LEŚNA, 38-321, MOSZCZENICA,21.10323283,49.72453224, 71.74166666666666, 973.6333333333333, 24.40833333333333,11.541666666666666,9.95, 2026-07-17 22:57:28
SZKOŁA PODSTAWOWA IM. JANA PAWŁA II W PODSZKLU, , 34-472, PODSZKLE,19.80198906,49.51218847, 74.61666666666666, 984.0749999999999, 21.275000000000002,10.808333333333332,10.55, 2026-07-17 22:57:28
SZKOŁA PODSTAWOWA NR 1 IM. ANNY LEŚKIEWICZ W ŁUŻNEJ, , 38-322, ŁUŻNA,21.05479856,49.7099261, 64.5, 972.3166666666666, 25.133333333333336,18.366666666666667,15.741666666666667, 2026-07-17 22:57:28
SZKOŁA PODSTAWOWA IMIENIA MIKOŁAJA KOPERNIKA W JASIENNEJ, Jasienna, 33-322, KORZENNA,20.82251961,49.71797638, 78.63333333333334, 961.6750000000001, 22.741666666666664,17.724999999999998,15.466666666666669, 2026-07-17 22:57:28
SZKOŁA PODSTAWOWA IM. ŻOŁNIERZY NIEZŁOMNYCH W BĄCZEJ-KUNINIE, , 33-335, BĄCZA-KUNINA,20.74304314,49.5362399, 59.574999999999996, 950.1750000000001, 25.5,19.883333333333333,19.05, 2026-07-17 22:57:28
SZKOŁA PODSTAWOWA IM. ŚW. JANA PAWŁA II W DZIADUSZYCACH, , 32-218, DZIADUSZYCE,20.26778753,50.38395929, 73.50833333333334, 980.3166666666666, 24.616666666666664,14.491666666666667,12.45, 2026-07-17 22:57:28
SZKOŁA PODSTAWOWA IM. JANA PAWŁA II W IWANOWICACH, ul. Jana Pawła II, 32-095, IWANOWICE WŁOŚCIAŃSKIE,19.97832221,50.22302756, 74.30833333333334, 976.0, 23.933333333333334,0.091666666666666,0.083333333333333, 2026-07-17 22:57:28
SZKOŁA PODSTAWOWA IM. M. STASIUKOWEJ W OCHOJNIE, UL. PODHALAŃSKA, 30-040, OCHOJNO,19.97311651,49.95071467, 58.35833333333333, 964.5, 26.21666666666667,14.533333333333331,12.266666666666667, 2026-07-17 22:57:28
SZKOŁA PODSTAWOWA NR 2 W WIEPRZU, UL. BESKIDZKA, 34-122, WIEPRZ,19.37250408,49.90710861, 71.70833333333333, 977.5083333333333, 22.78333333333333,5.274999999999999,4.475, 2026-07-17 22:57:28
SZKOŁA PODSTAWOWA NR 2 W STRYSZAWIE, , 34-205, STRYSZAWA,19.52672362,49.73285017, 63.55833333333334, 964.3666666666667, 24.400000000000002,7.008333333333333,6.399999999999999, 2026-07-17 22:57:28
SZKOŁA PODSTAWOWA NR 1 IM. JANA PAWŁA II W SUŁOSZOWEJ, UL. SZKOLNA, 32-045, SUŁOSZOWA,19.74205039,50.25958903, 71.24444444444445, 958.7444444444445, 24.5,14.155555555555557,13.077777777777778, 2026-07-17 22:57:28
SZKOŁA PODSTAWOWA INTEGRACYJNA NR 11 IM.MARII DĄBROWSKIEJ W TARNOWIE, UL. IGNACEGO MOŚCICKIEGO, 33-100, TARNÓW,20.95102273,50.01747959, 54.51666666666667, 985.1083333333332, 27.65833333333333,17.058333333333334,14.566666666666668, 2026-07-17 22:57:28
SZKOŁA PODSTAWOWA IM. ŚW. JANA KANTEGO W WOJNICZU, UL. SZKOLNA, 32-830, WOJNICZ,20.83758269,49.96104448, 65.23333333333333, 984.2583333333333, 26.191666666666666,11.883333333333333,11.883333333333333, 2026-07-17 22:57:28
SZKOŁA PODSTAWOWA NR 1 IM. KSIĘDZA KARDYNAŁA STEFANA WYSZYŃSKIEGO PRYMASA TYSIĄCLECIA W TOKARNI, , 32-436, TOKARNIA,19.87967275,49.73364856, 70.59166666666667, 961.9083333333333, 23.508333333333336,14.783333333333331,13.258333333333333, 2026-07-17 22:57:28
SZKOŁA PODSTAWOWA IM.NASZEJ PRZYRODY W WOŹNIKACH, UL. WADOWICKA, 34-103, WOŹNIKI,19.4909051,49.93959752, 65.71666666666667, 979.4166666666666, 24.84166666666667,12.75,10.983333333333334, 2026-07-17 22:57:28
PUBLICZNA SZKOŁA PODSTAWOWA IM. KS. KARD. STEFANA WYSZYŃSKIEGO W SZERZYNACH, , 38-246, SZERZYNY,21.24578398,49.80934435, 71.18333333333334, 977.3833333333333, 24.166666666666668,11.85,10.083333333333334, 2026-07-17 22:57:28
SZKOŁA PODSTAWOWA IM. TADEUSZA KOŚCIUSZKI W PRZEBIECZANACH, , 32-020, TOMASZKOWICE,20.10401518,49.97594973, 62.32000000000001, 975.11, 26.04,11.93,9.82, 2026-07-17 22:57:28
SZKOŁA PODSTAWOWA IM. MJR PIL. JERZEGO ISZKOWSKIEGO W TĘGOBORZY, ul. św. Floriana, 33-312, TĘGOBORZE,20.64046414,49.70908415, 64.38333333333334, 976.0666666666666, 26.275000000000002,18.15833333333333,17.033333333333335, 2026-07-17 22:57:28
SZKOŁA PODSTAWOWA IM. JANUSZA KORCZAKA W ZABIERZOWIE, UL. KOLEJOWA, 32-080, ZABIERZÓW,19.79921223,50.11711432, 59.875, 980.6, 26.78333333333333,12.1,10.216666666666669, 2026-07-17 22:57:28
SZKOŁA PODSTAWOWA IM. 600-LECIA UNIWERSYTETU JAGIELLOŃSKIEGO, , 32-010, WYSIOŁEK LUBORZYCKI,20.10930681,50.14467797, 59.14166666666667, 977.0583333333334, 27.566666666666666,16.7,14.075, 2026-07-17 22:57:28
SZKOŁA PODSTAWOWA NR 4 IM. FRANCESCO NULLO W OLKUSZU, UL. FRANCESCO NULLO, 32-300, OLKUSZ,19.56869547,50.2776362, 64.65833333333333, 965.8000000000001, 25.075,10.366666666666667,8.683333333333334, 2026-07-17 22:57:28
SZKOŁA PODSTAWOWA NR 3 IM. JANA PAWŁA II W MYŚLENICACH, UL. STANISŁAWA PARDYAKA, 32-400, MYŚLENICE,19.92808527,49.83246931, 58.4, 972.375, 26.366666666666664,10.925,9.558333333333334, 2026-07-17 22:57:28
PRZEDSZKOLE PUBLICZNE NR 8 POD STOKROTKĄ W TARNOWIE, ul. Marii Dąbrowskiej, 33-100, TARNÓW,21.01563158,50.01721574, 64.85000000000001, 987.1083333333332, 26.925,10.133333333333333,9.858333333333333, 2026-07-17 22:57:28
SZKOŁA PODSTAWOWA NR 5 IM. ORŁA BIAŁEGO W OŚWIĘCIMIU, UL. EUGENIUSZA KALICIŃSKIEGO, 32-600, OŚWIĘCIM,19.20401547,50.03682151, 72.65833333333333, 984.2583333333333, 23.108333333333334,5.241666666666666,4.341666666666667, 2026-07-17 22:57:28
SZKOŁA PODSTAWOWA NR 2 IM. MIKOŁAJA KOPERNIKA W DĄBROWIE TARNOWSKIEJ, UL. ZARĘBY, 33-200, DĄBROWA TARNOWSKA,20.98438323,50.17621862, 60.041666666666664, 984.3000000000001, 26.733333333333334,23.975,20.575, 2026-07-17 22:57:28
SZKOŁA PODSTAWOWA IM. ADAMA MICKIEWICZA W SZCZUCINIE, UL. KOŚCIUSZKI, 33-230, SZCZUCIN,21.07654652,50.3138434, 56.65, 988.5833333333334, 27.03333333333333,17.7,15.625, 2026-07-17 22:57:28
SZKOŁA PODSTAWOWA IM.A MICKIEWICZA W SZCZUROWEJ, UL. RYNEK, 32-820, SZCZUROWA,20.63632311,50.11814123, 60.44166666666666, 986.2166666666667, 27.25,16.383333333333333,13.95, 2026-07-17 22:57:28
SZKOŁA PODSTAWOWA IM. WŁADYSŁAWA ORKANA W WIŚNIOWEJ, , 32-412, WIŚNIOWA,20.12059796,49.78770432, 63.90833333333333, 969.225, 25.46666666666667,10.041666666666666,9.475, 2026-07-17 22:57:28
SZKOŁA PODSTAWOWA W SKAWINKACH, , 34-143, SKAWINKI,19.71387992,49.82536432, 73.88333333333334, 968.0333333333333, 22.78333333333333,9.075,7.941666666666666, 2026-07-17 22:57:28
SZKOŁA PODSTAWOWA IM. MARII KONOPNICKIEJ W ZEBRZYDOWICACH, , 34-130, ZEBRZYDOWICE,19.67195254,49.88535352, 65.97, 974.93, 25.15,8.35,7.17, 2026-07-17 22:57:28
SZKOŁA PODSTAWOWA W ZARZECZU DUŻYM, UL. ADAMA MICKIEWICZA, 33-207, RADGOSZCZ,21.09949127,50.28754905, 73.51666666666667, 987.125, 24.8,16.758333333333333,14.75, 2026-07-17 22:57:28
SZKOŁA PODSTAWOWA IM. ŚW. JANA PAWŁA II W RADZISZOWIE 32-052 RADZISZÓW UL. SZKOLNA 7, UL. SZKOLNA, 32-052, RADZISZÓW,19.8127236,49.93885997, 71.44, 984.74, 25.22,9.14,9.14, 2026-07-17 22:57:28
SZKOŁA PODSTAWOWA Z ODDZIAŁAMI SPECJALNYMI IM. MIKOŁAJA KOPERNIKA W CHEŁMCU, UL. MARCINKOWICKA, 33-395, CHEŁMIEC,20.66577368,49.632154, 69.04166666666667, 977.4, 27.175,29.49166666666667,26.46666666666667, 2026-07-17 22:57:28
